Date,Value,Secondary Value,Last Updated
07/31/2016,8010.0,-1.0,2016-07-31T20:35:49-0800
08/01/2016,14463.0,-1.0,2016-08-04T08:04:34-0800
08/02/2016,8078.0,-1.0,2016-08-04T08:04:34-0800
08/03/2016,11978.0,-1.0,2016-08-03T22:20:50-0800
08/04/2016,20678.0,-1.0,2016-08-04T22:14:04-0800
08/05/2016,9804.0,-1.0,2016-08-06T00:39:50-0800
08/06/2016,10750.0,-1.0,2016-08-07T00:10:19-0800
08/07/2016,4766.0,-1.0,2016-08-08T07:29:23-0800
08/08/2016,11376.0,-1.0,2016-08-08T23:38:43-0800
08/09/2016,17588.0,-1.0,2016-08-09T23:40:26-0800
08/10/2016,17462.0,-1.0,2016-08-10T21:48:07-0800
08/11/2016,16618.0,-1.0,2016-08-12T00:25:51-0800
08/12/2016,19724.0,-1.0,2016-08-13T08:52:34-0800
08/13/2016,14776.0,-1.0,2016-08-14T10:17:17-0800
08/14/2016,15240.0,-1.0,2016-08-15T07:44:48-0800
08/15/2016,15118.0,-1.0,2016-08-15T22:46:23-0800
08/16/2016,13372.0,-1.0,2016-08-16T23:21:38-0800
08/17/2016,14752.0,-1.0,2016-08-18T08:31:15-0800
08/18/2016,11954.0,-1.0,2016-08-18T22:01:27-0800
08/19/2016,14628.0,-1.0,2016-08-20T09:29:40-0800
08/20/2016,10750.0,-1.0,2016-08-21T11:34:13-0800
08/21/2016,6418.0,-1.0,2016-08-22T07:15:25-0800
08/22/2016,30822.0,-1.0,2016-08-23T07:10:24-0800
08/23/2016,24276.0,-1.0,2016-08-23T20:36:38-0800
08/24/2016,12118.0,-1.0,2016-08-24T22:50:29-0800
08/25/2016,15820.0,-1.0,2016-08-25T21:37:51-0800
08/26/2016,9852.0,-1.0,2016-08-26T20:19:24-0800
08/27/2016,10296.0,-1.0,2016-08-28T12:19:03-0800
08/28/2016,7254.0,-1.0,2016-08-29T15:50:08-0800
08/29/2016,15444.0,-1.0,2016-08-30T07:47:55-0800
08/30/2016,13848.0,-1.0,2016-08-30T23:17:30-0800
08/31/2016,13013.0,-1.0,2016-09-01T07:42:42-0800
09/01/2016,17304.0,-1.0,2016-09-02T12:04:47-0800
09/02/2016,14790.0,-1.0,2016-09-02T23:09:09-0800
09/03/2016,15296.0,-1.0,2016-09-06T08:04:25-0800
09/04/2016,17032.0,-1.0,2016-09-06T08:04:25-0800
09/05/2016,12372.0,-1.0,2016-09-06T08:04:24-0800
09/06/2016,8034.0,-1.0,2016-09-06T20:06:50-0800
09/07/2016,12220.0,-1.0,2016-09-08T00:06:45-0800
09/08/2016,9684.0,-1.0,2016-09-09T07:38:01-0800
09/09/2016,13846.0,-1.0,2016-09-10T12:59:06-0800
09/10/2016,8192.0,-1.0,2016-09-11T00:53:51-0800
09/11/2016,14032.0,-1.0,2016-09-11T20:57:05-0800
09/12/2016,12160.0,-1.0,2016-09-12T21:45:11-0800
09/13/2016,9750.0,-1.0,2016-09-13T20:05:31-0800
09/14/2016,10480.0,-1.0,2016-09-14T21:06:05-0800
09/15/2016,18572.0,-1.0,2016-09-15T20:54:33-0800
09/16/2016,11386.0,-1.0,2016-09-17T10:57:38-0800
09/17/2016,11676.0,-1.0,2016-09-18T00:06:22-0800
09/18/2016,12496.0,-1.0,2016-09-19T07:53:23-0800
09/19/2016,11758.0,-1.0,2016-09-20T07:49:34-0800
09/20/2016,15704.0,-1.0,2016-09-20T20:47:51-0800
09/21/2016,11400.0,-1.0,2016-09-22T01:47:18-0800
09/22/2016,16948.0,-1.0,2016-09-23T08:13:30-0800
09/23/2016,10730.0,-1.0,2016-09-25T10:34:52-0800
09/24/2016,9580.0,-1.0,2016-09-25T10:34:52-0800
09/25/2016,10740.0,-1.0,2016-09-25T20:30:12-0800
09/26/2016,13292.0,-1.0,2016-09-26T22:10:22-0800
09/27/2016,10374.0,-1.0,2016-09-27T22:57:53-0800
09/28/2016,8020.0,-1.0,2016-09-29T14:13:38-0800
09/29/2016,13462.0,-1.0,2016-09-30T16:30:14-0800
09/30/2016,9526.0,-1.0,2016-10-03T14:18:06-0800
10/01/2016,6086.0,-1.0,2016-10-03T14:18:06-0800
10/02/2016,10870.0,-1.0,2016-10-03T14:18:06-0800
10/03/2016,10488.0,-1.0,2016-10-04T15:12:22-0800
10/04/2016,11484.0,-1.0,2016-10-04T19:27:08-0800
07/14/2019,7336.0,0.0,2019-07-14T18:21:28-0800
07/15/2019,12696.0,0.0,2019-07-15T18:21:28-0800
07/16/2019,14915.0,0.0,2019-07-15T23:32:31-0800
07/17/2019,15968.0,0.0,2019-07-17T08:04:19-0800
07/18/2019,12943.0,0.0,2019-07-18T10:58:56-0800
07/19/2019,1587.0,0.0,2019-07-18T23:57:28-0800
08/15/2019,12720.0,0.0,2019-08-15T16:51:21-0800
08/16/2019,6879.0,0.0,2019-08-16T16:51:21-0800
09/01/2019,15324.0,0.0,2019-09-01T22:13:10-0800
09/02/2019,9154.0,0.0,2019-09-02T22:13:10-0800
09/03/2019,11272.0,0.0,2019-09-03T07:46:03-0800
09/04/2019,10197.0,0.0,2019-09-04T08:34:56-0800
09/05/2019,10600.0,0.0,2019-09-05T06:09:21-0800
09/06/2019,14949.0,0.0,2019-09-06T10:58:01-0800
09/07/2019,5744.0,0.0,2019-09-07T09:26:01-0800
09/08/2019,3634.0,0.0,2019-09-08T09:30:00-0800
09/09/2019,11247.0,0.0,2019-09-09T08:41:36-0800
09/10/2019,10288.0,0.0,2019-09-10T08:26:39-0800
09/11/2019,5450.0,0.0,2019-09-11T07:49:23-0800
11/30/2019,8253.0,0.0,2019-11-30T11:31:44-0800
12/01/2019,12025.0,0.0,2019-12-01T11:31:44-0800
12/02/2019,12240.0,0.0,2019-12-02T09:01:34-0800
12/03/2019,11524.0,0.0,2019-12-03T09:34:18-0800
12/04/2019,14335.0,0.0,2019-12-04T10:52:04-0800
12/05/2019,12615.0,0.0,2019-12-05T09:03:24-0800
12/06/2019,12290.0,0.0,2019-12-06T09:53:13-0800
12/07/2019,8547.0,0.0,2019-12-07T11:46:32-0800
12/08/2019,5767.0,0.0,2019-12-08T10:43:43-0800
12/09/2019,11493.0,0.0,2019-12-09T08:52:07-0800
12/10/2019,5680.0,0.0,2019-12-10T08:31:26-0800
12/11/2019,11470.0,0.0,2019-12-11T09:01:34-0800
12/12/2019,9018.0,0.0,2019-12-12T09:12:32-0800
12/13/2019,9996.0,0.0,2019-12-13T20:01:19-0800
12/14/2019,7538.0,0.0,2019-12-14T11:14:08-0800
12/15/2019,9595.0,0.0,2019-12-15T10:29:34-0800
12/16/2019,11990.0,0.0,2019-12-16T09:33:01-0800
12/17/2019,11180.0,0.0,2019-12-17T09:30:32-0800
12/18/2019,12193.0,0.0,2019-12-18T11:49:14-0800
12/19/2019,6501.0,0.0,2019-12-19T19:00:55-0800
12/25/2019,3781.0,0.0,2019-12-25T19:19:24-0800
12/26/2019,4044.0,0.0,2019-12-26T19:19:24-0800
01/04/2020,3374.0,0.0,2020-01-04T09:01:32-0800
01/05/2020,13923.0,0.0,2020-01-05T09:01:32-0800
01/06/2020,8686.0,0.0,2020-01-06T08:01:49-0800
01/07/2020,12555.0,0.0,2020-01-07T09:06:01-0800
01/08/2020,12675.0,0.0,2020-01-08T09:22:56-0800
01/09/2020,9951.0,0.0,2020-01-09T09:18:43-0800
01/10/2020,4081.0,0.0,2020-01-10T12:09:20-0800
01/11/2020,7871.0,0.0,2020-01-11T09:48:33-0800
01/12/2020,7262.0,0.0,2020-01-12T12:24:19-0800
01/13/2020,12266.0,0.0,2020-01-13T09:31:31-0800
01/16/2020,15777.0,0.0,2020-01-16T10:05:00-0800
01/17/2020,11620.0,0.0,2020-01-17T10:05:00-0800
01/18/2020,6547.0,0.0,2020-01-18T11:46:27-0800
01/19/2020,4057.0,0.0,2020-01-19T09:50:53-0800
01/20/2020,4388.0,0.0,2020-01-20T11:36:10-0800
01/21/2020,12937.0,0.0,2020-01-21T08:50:01-0800
02/04/2020,743.0,0.0,2020-02-04T17:39:42-0800
02/05/2020,7756.0,0.0,2020-02-05T17:39:42-0800
02/19/2020,5395.0,0.0,2020-02-19T18:53:21-0800
02/20/2020,16378.0,0.0,2020-02-20T18:53:22-0800
06/08/2020,8056.0,0.0,2020-06-08T17:25:04-0800
06/09/2020,6852.0,0.0,2020-06-09T17:25:04-0800
06/24/2020,10707.0,0.0,2020-06-24T07:47:08-0800
06/25/2020,10988.0,0.0,2020-06-25T07:47:08-0800
06/26/2020,9063.0,0.0,2020-06-26T07:31:20-0800
06/27/2020,9144.0,0.0,2020-06-27T09:37:20-0800
06/28/2020,6847.0,0.0,2020-06-28T09:13:32-0800
06/29/2020,14235.0,0.0,2020-06-28T23:44:07-0800
06/30/2020,9186.0,0.0,2020-06-30T07:53:35-0800
07/01/2020,13156.0,0.0,2020-07-01T08:09:55-0800
07/02/2020,11506.0,0.0,2020-07-01T23:19:49-0800
07/03/2020,14389.0,0.0,2020-07-03T13:12:53-0800
07/04/2020,16045.0,0.0,2020-07-04T09:08:45-0800
07/05/2020,11442.0,0.0,2020-07-05T09:48:06-0800
07/06/2020,14831.0,0.0,2020-07-06T09:00:05-0800
07/07/2020,14710.0,0.0,2020-07-07T09:32:48-0800
07/08/2020,10825.0,0.0,2020-07-08T10:49:25-0800
07/09/2020,10517.0,0.0,2020-07-09T08:18:14-0800
07/10/2020,10135.0,0.0,2020-07-10T07:47:41-0800
07/11/2020,11748.0,0.0,2020-07-11T14:40:11-0800
07/12/2020,13316.0,0.0,2020-07-12T10:39:41-0800
07/13/2020,13180.0,0.0,2020-07-13T07:48:49-0800
07/14/2020,11809.0,0.0,2020-07-14T07:48:22-0800
07/15/2020,13495.0,0.0,2020-07-15T07:43:57-0800
07/16/2020,12853.0,0.0,2020-07-16T08:14:00-0800
07/17/2020,9926.0,0.0,2020-07-17T08:19:03-0800
07/18/2020,14868.0,0.0,2020-07-17T23:21:58-0800
07/19/2020,15761.0,0.0,2020-07-19T09:23:21-0800
07/20/2020,11150.0,0.0,2020-07-19T23:37:54-0800
07/21/2020,11972.0,0.0,2020-07-21T07:45:32-0800
07/22/2020,11351.0,0.0,2020-07-22T08:26:38-0800
07/23/2020,9579.0,0.0,2020-07-22T23:51:59-0800
07/24/2020,11.0,0.0,2020-07-23T23:47:21-0800
09/27/2020,9402.0,0.0,2020-09-27T08:32:50-0800
09/28/2020,10152.0,0.0,2020-09-28T08:32:50-0800
09/29/2020,13107.0,0.0,2020-09-29T08:10:54-0800
09/30/2020,7648.0,0.0,2020-09-30T08:10:47-0800
10/01/2020,12477.0,0.0,2020-09-30T23:22:06-0800
10/02/2020,11720.0,0.0,2020-10-02T08:22:07-0800
10/03/2020,9327.0,0.0,2020-10-03T00:31:36-0800
10/04/2020,12397.0,0.0,2020-10-04T09:36:14-0800
10/05/2020,8702.0,0.0,2020-10-05T09:02:59-0800
10/06/2020,11128.0,0.0,2020-10-06T08:01:38-0800
10/07/2020,11928.0,0.0,2020-10-07T08:20:16-0800
10/08/2020,12113.0,0.0,2020-10-08T07:39:11-0800
10/09/2020,10848.0,0.0,2020-10-09T07:37:42-0800
10/10/2020,11676.0,0.0,2020-10-10T00:13:38-0800
10/11/2020,7091.0,0.0,2020-10-11T10:29:49-0800
10/12/2020,14921.0,0.0,2020-10-12T09:31:55-0800
10/13/2020,14190.0,0.0,2020-10-13T11:06:48-0800
10/14/2020,11671.0,0.0,2020-10-14T08:02:50-0800
10/15/2020,13006.0,0.0,2020-10-14T23:11:23-0800
10/16/2020,10946.0,0.0,2020-10-16T08:06:21-0800
10/17/2020,10642.0,0.0,2020-10-16T23:19:16-0800
10/18/2020,13373.0,0.0,2020-10-18T10:01:38-0800
10/19/2020,9570.0,0.0,2020-10-18T23:01:55-0800
10/20/2020,17009.0,0.0,2020-10-20T08:19:35-0800
10/21/2020,11185.0,0.0,2020-10-20T23:03:45-0800
10/22/2020,12461.0,0.0,2020-10-22T08:17:20-0800
10/23/2020,8229.0,0.0,2020-10-23T08:20:19-0800
10/24/2020,14164.0,0.0,2020-10-23T23:44:59-0800
10/25/2020,15046.0,0.0,2020-10-25T09:32:04-0800
10/26/2020,11859.0,0.0,2020-10-25T23:30:05-0800
10/27/2020,11492.0,0.0,2020-10-26T23:22:54-0800
10/28/2020,13403.0,0.0,2020-10-27T23:45:59-0800
10/29/2020,8370.0,0.0,2020-10-29T08:28:00-0800
10/30/2020,11626.0,0.0,2020-10-29T23:17:05-0800
12/12/2020,688.0,0.0,2020-12-12T19:23:34-0800
12/13/2020,20462.0,0.0,2020-12-13T21:26:44-0800
12/14/2020,9614.0,0.0,2020-12-14T16:14:13-0800
12/15/2020,8167.0,0.0,2020-12-15T20:45:32-0800
12/16/2020,5474.0,0.0,2020-12-16T22:25:30-0800
12/17/2020,6674.0,0.0,2020-12-17T22:04:25-0800
12/18/2020,6129.0,0.0,2020-12-18T19:16:54-0800
12/19/2020,8964.0,0.0,2020-12-19T15:44:12-0800
12/20/2020,8320.0,0.0,2020-12-20T18:27:51-0800
12/21/2020,11071.0,0.0,2020-12-21T18:30:59-0800
12/22/2020,11440.0,0.0,2020-12-22T20:29:25-0800
12/23/2020,9689.0,0.0,2020-12-23T20:48:46-0800
12/24/2020,11653.0,0.0,2020-12-24T20:00:19-0800
12/25/2020,8689.0,0.0,2020-12-25T21:17:13-0800
12/26/2020,7382.0,0.0,2020-12-26T21:22:26-0800
12/27/2020,11431.0,0.0,2020-12-27T20:54:35-0800
12/28/2020,13385.0,0.0,2020-12-28T22:15:51-0800
12/29/2020,13266.0,0.0,2020-12-29T22:08:57-0800
12/30/2020,15102.0,0.0,2020-12-30T21:14:59-0800
12/31/2020,14211.0,0.0,2020-12-31T22:38:39-0800
01/01/2021,12886.0,0.0,2021-01-01T22:09:07-0800
01/02/2021,16616.0,0.0,2021-01-02T22:15:50-0800
01/03/2021,13108.0,0.0,2021-01-03T21:14:19-0800
01/04/2021,10618.0,0.0,2021-01-04T19:31:11-0800
01/05/2021,11018.0,0.0,2021-01-05T21:20:09-0800
01/06/2021,12666.0,0.0,2021-01-06T21:47:00-0800
01/07/2021,13960.0,0.0,2021-01-07T21:32:51-0800
01/08/2021,9462.0,0.0,2021-01-08T22:02:50-0800
01/09/2021,7636.0,0.0,2021-01-09T21:17:23-0800
01/10/2021,11413.0,0.0,2021-01-10T21:08:56-0800
01/11/2021,7512.0,0.0,2021-01-11T21:11:12-0800
01/12/2021,11180.0,0.0,2021-01-12T18:48:43-0800
01/13/2021,11315.0,0.0,2021-01-13T22:21:17-0800
01/14/2021,13086.0,0.0,2021-01-14T22:59:19-0800
01/15/2021,10407.0,0.0,2021-01-15T22:53:41-0800
01/16/2021,13750.0,0.0,2021-01-16T22:40:42-0800
01/17/2021,12229.0,0.0,2021-01-17T22:58:07-0800
01/18/2021,8889.0,0.0,2021-01-18T22:07:26-0800
01/19/2021,10685.0,0.0,2021-01-19T22:56:19-0800
01/20/2021,9821.0,0.0,2021-01-20T23:00:00-0800
01/21/2021,10748.0,0.0,2021-01-21T23:00:00-0800
01/22/2021,8835.0,0.0,2021-01-22T22:56:07-0800
01/23/2021,14061.0,0.0,2021-01-23T22:57:21-0800
01/24/2021,4584.0,0.0,2021-01-24T22:41:04-0800
01/25/2021,5030.0,0.0,2021-01-25T22:13:50-0800
01/26/2021,10740.0,0.0,2021-01-26T21:46:48-0800
01/27/2021,5152.0,0.0,2021-01-27T22:45:17-0800
01/28/2021,7771.0,0.0,2021-01-28T22:45:43-0800
01/29/2021,2209.0,0.0,2021-01-29T22:59:47-0800
01/30/2021,13132.0,0.0,2021-01-30T23:00:00-0800
01/31/2021,11348.0,0.0,2021-01-31T22:53:45-0800
02/01/2021,9006.0,0.0,2021-02-01T22:50:01-0800
02/02/2021,6839.0,0.0,2021-02-02T22:56:13-0800
02/03/2021,12836.0,0.0,2021-02-03T23:00:00-0800
02/04/2021,9486.0,0.0,2021-02-04T22:59:59-0800
02/05/2021,12143.0,0.0,2021-02-05T22:59:43-0800
02/06/2021,6460.0,0.0,2021-02-06T22:54:12-0800
02/07/2021,15862.0,0.0,2021-02-07T22:59:31-0800
02/08/2021,10163.0,0.0,2021-02-08T22:48:29-0800
02/09/2021,15423.0,0.0,2021-02-09T23:00:00-0800
02/10/2021,12289.0,0.0,2021-02-10T22:57:03-0800
02/11/2021,9882.0,0.0,2021-02-11T22:47:47-0800
02/12/2021,9574.0,0.0,2021-02-12T23:00:00-0800
02/13/2021,16592.0,0.0,2021-02-13T22:57:26-0800
02/14/2021,6253.0,0.0,2021-02-14T23:00:00-0800
02/15/2021,15477.0,0.0,2021-02-15T23:00:00-0800
02/16/2021,12284.0,0.0,2021-02-16T23:00:00-0800
02/17/2021,9508.0,0.0,2021-02-17T22:56:05-0800
02/18/2021,12580.0,0.0,2021-02-18T22:51:04-0800
02/19/2021,12674.0,0.0,2021-02-19T22:54:14-0800
02/20/2021,18082.0,0.0,2021-02-20T22:59:43-0800
02/21/2021,9752.0,0.0,2021-02-21T22:54:32-0800
02/22/2021,11450.0,0.0,2021-02-22T21:35:15-0800
02/23/2021,9740.0,0.0,2021-02-23T23:00:00-0800
02/24/2021,8093.0,0.0,2021-02-24T21:20:42-0800
02/25/2021,10683.0,0.0,2021-02-25T22:57:23-0800
02/26/2021,8662.0,0.0,2021-02-26T21:22:55-0800
02/27/2021,19061.0,0.0,2021-02-27T22:22:51-0800
02/28/2021,12110.0,0.0,2021-02-28T21:29:15-0800
03/01/2021,8780.0,0.0,2021-03-01T22:57:26-0800
03/02/2021,7978.0,0.0,2021-03-02T22:56:55-0800
03/03/2021,7332.0,0.0,2021-03-03T21:13:07-0800
03/04/2021,8982.0,0.0,2021-03-04T22:54:44-0800
03/05/2021,9910.0,0.0,2021-03-05T21:28:52-0800
03/06/2021,10384.0,0.0,2021-03-06T22:59:02-0800
03/07/2021,9360.0,0.0,2021-03-07T22:55:56-0800
03/08/2021,10588.0,0.0,2021-03-08T22:57:59-0800
03/09/2021,8074.0,0.0,2021-03-09T21:03:56-0800
03/10/2021,10264.0,0.0,2021-03-10T22:58:41-0800
03/11/2021,8790.0,0.0,2021-03-11T22:59:42-0800
03/12/2021,11710.0,0.0,2021-03-12T22:46:19-0800
03/13/2021,13402.0,0.0,2021-03-13T23:00:00-0800
03/14/2021,9390.0,0.0,2021-03-14T22:17:12-0800
03/15/2021,10142.0,0.0,2021-03-15T20:09:39-0800
03/16/2021,10502.0,0.0,2021-03-16T19:47:19-0800
03/17/2021,10442.0,0.0,2021-03-17T22:59:50-0800
03/18/2021,6282.0,0.0,2021-03-18T22:56:43-0800
03/19/2021,9580.0,0.0,2021-03-19T22:50:45-0800
03/20/2021,13330.0,0.0,2021-03-20T18:46:44-0800
03/21/2021,5038.0,0.0,2021-03-21T20:36:29-0800
03/22/2021,12146.0,0.0,2021-03-22T22:22:49-0800
03/23/2021,13688.0,0.0,2021-03-23T22:57:57-0800
03/24/2021,8426.0,0.0,2021-03-24T20:26:38-0800
03/25/2021,6982.0,0.0,2021-03-25T17:24:43-0800
03/26/2021,2662.0,0.0,2021-03-26T21:20:27-0800
03/27/2021,4438.0,0.0,2021-03-27T18:20:17-0800
03/28/2021,10202.0,0.0,2021-03-28T22:50:24-0800
03/29/2021,9318.0,0.0,2021-03-29T22:59:24-0800
03/30/2021,7844.0,0.0,2021-03-30T22:58:24-0800
03/31/2021,10690.0,0.0,2021-03-31T20:33:02-0800
04/01/2021,9182.0,0.0,2021-04-01T22:53:03-0800
04/02/2021,13942.0,0.0,2021-04-02T20:30:41-0800
04/03/2021,13032.0,0.0,2021-04-03T22:55:16-0800
04/04/2021,11258.0,0.0,2021-04-04T22:57:00-0800
04/05/2021,9072.0,0.0,2021-04-05T22:32:11-0800
04/06/2021,8486.0,0.0,2021-04-06T22:56:28-0800
04/07/2021,8068.0,0.0,2021-04-07T22:10:57-0800
04/08/2021,10188.0,0.0,2021-04-08T22:36:19-0800
04/09/2021,11124.0,0.0,2021-04-09T22:55:50-0800
04/10/2021,15414.0,0.0,2021-04-10T22:45:41-0800
04/11/2021,10336.0,0.0,2021-04-11T22:53:27-0800
04/12/2021,8158.0,0.0,2021-04-12T20:23:44-0800
04/13/2021,13474.0,0.0,2021-04-13T22:57:41-0800
04/14/2021,7686.0,0.0,2021-04-14T22:44:27-0800
04/15/2021,10178.0,0.0,2021-04-15T21:23:42-0800
04/16/2021,10160.0,0.0,2021-04-16T22:27:17-0800
04/17/2021,14644.0,0.0,2021-04-17T22:19:03-0800
04/18/2021,13944.0,0.0,2021-04-18T21:36:59-0800
04/19/2021,11084.0,0.0,2021-04-19T22:51:13-0800
04/20/2021,9180.0,0.0,2021-04-20T22:57:51-0800
04/21/2021,9848.0,0.0,2021-04-21T20:42:00-0800
04/22/2021,8513.0,0.0,2021-04-22T23:00:00-0800
04/23/2021,11664.0,0.0,2021-04-23T22:45:21-0800
04/24/2021,4734.0,0.0,2021-04-24T22:59:10-0800
04/25/2021,10938.0,0.0,2021-04-25T21:48:51-0800
04/26/2021,8474.0,0.0,2021-04-26T20:28:38-0800
04/27/2021,11358.0,0.0,2021-04-27T20:52:53-0800
04/28/2021,10936.0,0.0,2021-04-28T22:26:14-0800
04/29/2021,6784.0,0.0,2021-04-29T20:44:28-0800
04/30/2021,7614.0,0.0,2021-04-30T21:38:48-0800
05/01/2021,15270.0,0.0,2021-05-01T22:50:10-0800
05/02/2021,10934.0,0.0,2021-05-02T21:10:59-0800
05/03/2021,7224.0,0.0,2021-05-03T23:00:00-0800
05/04/2021,10492.0,0.0,2021-05-04T22:54:49-0800
05/05/2021,11020.0,0.0,2021-05-05T20:43:59-0800
05/06/2021,10962.0,0.0,2021-05-06T22:15:21-0800
05/07/2021,3702.0,0.0,2021-05-07T22:57:25-0800
05/08/2021,10310.0,0.0,2021-05-08T22:39:55-0800
05/09/2021,16514.0,0.0,2021-05-09T22:48:55-0800
05/10/2021,10812.0,0.0,2021-05-10T22:45:48-0800
05/11/2021,5636.0,0.0,2021-05-11T22:45:37-0800
05/12/2021,8178.0,0.0,2021-05-12T20:55:44-0800
05/13/2021,7364.0,0.0,2021-05-13T22:18:10-0800
05/14/2021,9644.0,0.0,2021-05-14T22:06:08-0800
05/15/2021,11450.0,0.0,2021-05-15T22:16:42-0800
05/16/2021,7136.0,0.0,2021-05-16T22:12:07-0800
05/17/2021,7076.0,0.0,2021-05-17T20:37:49-0800
05/18/2021,6824.0,0.0,2021-05-18T21:59:47-0800
05/19/2021,11442.0,0.0,2021-05-19T20:50:11-0800
05/20/2021,8318.0,0.0,2021-05-20T21:23:57-0800
05/21/2021,13320.0,0.0,2021-05-21T22:34:58-0800
05/22/2021,7326.0,0.0,2021-05-22T22:36:46-0800
05/23/2021,3004.0,0.0,2021-05-23T22:38:13-0800
05/24/2021,7370.0,0.0,2021-05-24T22:03:57-0800
05/25/2021,9612.0,0.0,2021-05-25T22:15:03-0800
05/26/2021,7844.0,0.0,2021-05-26T19:35:28-0800
05/27/2021,5050.0,0.0,2021-05-27T22:46:32-0800
05/28/2021,8826.0,0.0,2021-05-28T22:56:09-0800
05/29/2021,18632.0,0.0,2021-05-29T16:09:45-0800
05/30/2021,17882.0,0.0,2021-05-30T22:58:15-0800
05/31/2021,22246.0,0.0,2021-05-31T21:07:27-0800
06/01/2021,6858.0,0.0,2021-06-01T21:32:36-0800
06/02/2021,11518.0,0.0,2021-06-02T22:02:14-0800
06/03/2021,9176.0,0.0,2021-06-03T22:23:12-0800
06/04/2021,8598.0,0.0,2021-06-04T22:42:23-0800
06/05/2021,9188.0,0.0,2021-06-05T23:00:00-0800
06/06/2021,7045.0,0.0,2021-06-06T21:59:43-0800
06/07/2021,13244.0,0.0,2021-06-07T22:35:17-0800
06/08/2021,10574.0,0.0,2021-06-08T23:00:00-0800
06/09/2021,8527.0,0.0,2021-06-09T21:23:12-0800
06/10/2021,7762.0,0.0,2021-06-10T20:13:25-0800
06/11/2021,9476.0,0.0,2021-06-11T22:54:58-0800
06/12/2021,12751.0,0.0,2021-06-12T23:00:00-0800
06/13/2021,12790.0,0.0,2021-06-13T22:07:30-0800
06/14/2021,9856.0,0.0,2021-06-14T20:17:47-0800
06/15/2021,9030.0,0.0,2021-06-15T22:14:51-0800
06/16/2021,5528.0,0.0,2021-06-16T22:45:51-0800
06/17/2021,9596.0,0.0,2021-06-17T22:24:30-0800
06/18/2021,10288.0,0.0,2021-06-18T21:23:33-0800
06/19/2021,9068.0,0.0,2021-06-19T22:51:21-0800
06/20/2021,16516.0,0.0,2021-06-20T22:30:22-0800
06/21/2021,4.0,0.0,2021-06-21T00:19:34-0800
06/22/2021,5358.0,0.0,2021-06-22T22:59:23-0800
06/23/2021,7692.0,0.0,2021-06-23T22:46:52-0800
06/24/2021,6438.0,0.0,2021-06-24T20:15:39-0800
06/25/2021,15355.0,0.0,2021-06-25T20:29:59-0800
06/26/2021,9466.0,0.0,2021-06-26T20:52:58-0800
06/27/2021,9752.0,0.0,2021-06-27T20:47:36-0800
06/28/2021,6638.0,0.0,2021-06-28T21:26:29-0800
06/29/2021,8462.0,0.0,2021-06-29T22:59:23-0800
06/30/2021,8684.0,0.0,2021-06-30T22:27:51-0800
07/01/2021,7346.0,0.0,2021-07-01T22:29:13-0800
07/02/2021,8506.0,0.0,2021-07-02T22:32:53-0800
07/03/2021,14371.0,0.0,2021-07-03T22:47:04-0800
07/04/2021,15890.0,0.0,2021-07-04T22:35:54-0800
07/05/2021,8756.0,0.0,2021-07-05T22:23:28-0800
07/06/2021,7602.0,0.0,2021-07-06T22:42:48-0800
07/07/2021,5740.0,0.0,2021-07-07T20:20:34-0800
07/08/2021,8072.0,0.0,2021-07-08T22:51:54-0800
07/09/2021,11304.0,0.0,2021-07-09T22:59:27-0800
07/10/2021,14942.0,0.0,2021-07-10T23:00:00-0800
07/11/2021,3035.0,0.0,2021-07-10T23:08:56-0800
07/12/2021,12294.0,0.0,2021-07-12T22:03:52-0800
07/13/2021,10282.0,0.0,2021-07-13T22:30:51-0800
07/14/2021,4288.0,0.0,2021-07-14T22:19:45-0800
07/15/2021,5492.0,0.0,2021-07-15T22:15:14-0800
07/16/2021,3112.0,0.0,2021-07-16T19:28:42-0800
07/17/2021,6970.0,0.0,2021-07-17T21:41:19-0800
07/18/2021,9768.0,0.0,2021-07-18T22:33:26-0800
07/19/2021,6466.0,0.0,2021-07-19T21:54:57-0800
07/20/2021,7996.0,0.0,2021-07-20T20:41:55-0800
07/21/2021,5716.0,0.0,2021-07-21T19:00:12-0800
07/22/2021,9154.0,0.0,2021-07-22T21:46:29-0800
07/24/2021,51712.0,0.0,2021-07-24T20:59:21-0800
07/25/2021,5566.0,0.0,2021-07-25T19:59:18-0800
07/26/2021,7212.0,0.0,2021-07-26T22:34:18-0800
07/27/2021,10054.0,0.0,2021-07-27T22:05:39-0800
07/28/2021,21464.0,0.0,2021-07-28T22:56:08-0800
07/29/2021,8042.0,0.0,2021-07-29T22:57:28-0800
07/30/2021,7572.0,0.0,2021-07-30T22:47:23-0800
07/31/2021,7388.0,0.0,2021-07-31T22:46:42-0800
08/01/2021,10382.0,0.0,2021-08-01T22:35:52-0800
08/02/2021,10818.0,0.0,2021-08-02T22:46:07-0800
08/03/2021,8152.0,0.0,2021-08-03T22:01:08-0800
08/04/2021,6922.0,0.0,2021-08-04T22:40:53-0800
08/05/2021,7274.0,0.0,2021-08-05T22:29:08-0800
08/06/2021,7513.0,0.0,2021-08-06T23:00:00-0800
08/07/2021,10308.0,0.0,2021-08-07T23:00:00-0800
08/08/2021,7259.0,0.0,2021-08-08T22:48:37-0800
08/09/2021,5970.0,0.0,2021-08-09T22:59:10-0800
08/10/2021,6333.0,0.0,2021-08-10T22:26:58-0800
08/11/2021,6854.0,0.0,2021-08-11T22:51:18-0800
08/12/2021,6654.0,0.0,2021-08-12T22:47:23-0800
08/13/2021,2596.0,0.0,2021-08-13T22:53:23-0800
08/14/2021,12257.0,0.0,2021-08-14T23:00:00-0800
08/15/2021,7857.0,0.0,2021-08-15T22:20:46-0800
08/16/2021,9648.0,0.0,2021-08-16T21:33:21-0800
08/17/2021,4660.0,0.0,2021-08-17T22:50:49-0800
08/18/2021,7798.0,0.0,2021-08-18T22:49:59-0800
08/19/2021,9242.0,0.0,2021-08-19T21:32:26-0800
08/20/2021,5544.0,0.0,2021-08-20T21:32:14-0800
08/21/2021,3372.0,0.0,2021-08-21T22:26:34-0800
08/22/2021,9410.0,0.0,2021-08-22T21:35:43-0800
08/23/2021,6590.0,0.0,2021-08-23T22:59:54-0800
08/24/2021,11326.0,0.0,2021-08-24T22:54:46-0800
08/25/2021,10460.0,0.0,2021-08-25T22:12:00-0800
08/26/2021,1970.0,0.0,2021-08-26T20:37:19-0800
08/28/2021,9196.0,0.0,2021-08-28T22:04:25-0800
08/29/2021,8856.0,0.0,2021-08-29T20:41:33-0800
08/30/2021,5402.0,0.0,2021-08-30T21:39:04-0800
08/31/2021,8984.0,0.0,2021-08-31T22:46:05-0800
09/01/2021,5490.0,0.0,2021-09-01T22:43:48-0800
09/02/2021,6914.0,0.0,2021-09-02T22:41:53-0800
09/03/2021,11770.0,0.0,2021-09-03T22:57:46-0800
09/04/2021,7808.0,0.0,2021-09-04T22:59:05-0800
09/05/2021,9982.0,0.0,2021-09-05T22:46:09-0800
09/06/2021,9780.0,0.0,2021-09-06T22:18:12-0800
09/07/2021,10460.0,0.0,2021-09-07T20:22:37-0800
09/08/2021,4952.0,0.0,2021-09-08T22:53:31-0800
09/09/2021,5604.0,0.0,2021-09-09T22:03:09-0800
09/10/2021,7158.0,0.0,2021-09-10T20:31:04-0800
09/11/2021,3658.0,0.0,2021-09-11T22:25:37-0800
09/12/2021,3284.0,0.0,2021-09-12T19:06:03-0800
09/13/2021,8.0,0.0,2021-09-13T10:19:21-0800
09/19/2021,7942.0,0.0,2021-09-19T15:58:12-0800
09/20/2021,9713.0,0.0,2021-09-20T07:03:24-0800
09/21/2021,5382.0,0.0,2021-09-20T23:01:28-0800
09/22/2021,12458.0,0.0,2021-09-22T06:41:30-0800
09/23/2021,11239.0,0.0,2021-09-23T07:07:25-0800
09/24/2021,10034.0,0.0,2021-09-23T23:13:21-0800
09/25/2021,10175.0,0.0,2021-09-24T23:08:39-0800
09/26/2021,5837.0,0.0,2021-09-26T10:16:44-0800
09/27/2021,8484.0,0.0,2021-09-27T07:05:36-0800
09/28/2021,3644.0,0.0,2021-09-28T11:10:23-0800
09/29/2021,10616.0,0.0,2021-09-29T07:28:59-0800
09/30/2021,6238.0,0.0,2021-09-29T23:47:11-0800
10/01/2021,5263.0,0.0,2021-09-30T23:26:39-0800
10/02/2021,10894.0,0.0,2021-10-02T09:01:41-0800
10/03/2021,14143.0,0.0,2021-10-03T09:33:04-0800
10/04/2021,14176.0,0.0,2021-10-04T07:22:05-0800
10/05/2021,7006.0,0.0,2021-10-04T23:02:56-0800
10/06/2021,6832.0,0.0,2021-10-05T23:48:48-0800
10/07/2021,7844.0,0.0,2021-10-07T07:12:13-0800
10/08/2021,11597.0,0.0,2021-10-08T00:04:30-0800
10/09/2021,9646.0,0.0,2021-10-09T09:40:10-0800
10/10/2021,7247.0,0.0,2021-10-10T09:43:11-0800
10/11/2021,6009.0,0.0,2021-10-11T07:09:18-0800
10/12/2021,8428.0,0.0,2021-10-12T07:22:35-0800
10/13/2021,11577.0,0.0,2021-10-12T23:12:35-0800
10/14/2021,10392.0,0.0,2021-10-14T07:36:27-0800
10/15/2021,7120.0,0.0,2021-10-15T07:47:07-0800
10/16/2021,10378.0,0.0,2021-10-15T23:19:32-0800
10/17/2021,15609.0,0.0,2021-10-17T00:14:08-0800
10/18/2021,6858.0,0.0,2021-10-18T07:23:37-0800
10/19/2021,9217.0,0.0,2021-10-19T07:24:54-0800
10/20/2021,6968.0,0.0,2021-10-20T07:36:52-0800
10/21/2021,8000.0,0.0,2021-10-21T07:51:04-0800
10/22/2021,7284.0,0.0,2021-10-21T23:42:43-0800
10/23/2021,7751.0,0.0,2021-10-23T09:02:28-0800
10/24/2021,4097.0,0.0,2021-10-24T09:47:05-0800
10/25/2021,7040.0,0.0,2021-10-25T07:31:22-0800
10/26/2021,7135.0,0.0,2021-10-26T07:16:38-0800
10/27/2021,6528.0,0.0,2021-10-26T23:27:48-0800
10/28/2021,6155.0,0.0,2021-10-28T07:19:31-0800
10/29/2021,148.0,0.0,2021-10-29T07:40:40-0800
10/30/2021,10770.0,0.0,2021-10-30T09:43:12-0800
10/31/2021,11377.0,0.0,2021-10-30T20:46:50-0800
11/01/2021,9274.0,0.0,2021-10-31T20:53:32-0800
11/02/2021,8643.0,0.0,2021-11-01T20:57:08-0800
11/03/2021,3535.0,0.0,2021-11-02T20:57:14-0800
11/04/2021,5030.0,0.0,2021-11-03T21:00:00-0800
11/05/2021,1073.0,0.0,2021-11-04T20:59:46-0800
11/06/2021,460.0,0.0,2021-11-05T20:43:23-0800
11/07/2021,11720.0,0.0,2021-11-06T20:59:34-0800
11/08/2021,12045.0,0.0,2021-11-08T20:59:05-0800
11/09/2021,12807.0,0.0,2021-11-09T20:57:14-0800
11/10/2021,15264.0,0.0,2021-11-10T20:59:22-0800
11/11/2021,10299.0,0.0,2021-11-11T20:59:57-0800
11/12/2021,2827.0,0.0,2021-11-11T21:05:17-0800
11/13/2021,2506.0,0.0,2021-11-13T21:00:00-0800
11/14/2021,6993.0,0.0,2021-11-14T20:33:50-0800
11/15/2021,12582.0,0.0,2021-11-15T20:47:36-0800
11/16/2021,6292.0,0.0,2021-11-16T20:31:58-0800
11/17/2021,10703.0,0.0,2021-11-17T21:00:00-0800
11/18/2021,9249.0,0.0,2021-11-18T20:59:45-0800
11/19/2021,9938.0,0.0,2021-11-19T19:54:45-0800
11/20/2021,9611.0,0.0,2021-11-20T20:47:58-0800
11/21/2021,10236.0,0.0,2021-11-21T20:51:53-0800
11/22/2021,12807.0,0.0,2021-11-22T20:59:25-0800
11/23/2021,11634.0,0.0,2021-11-23T20:57:48-0800
11/24/2021,8726.0,0.0,2021-11-24T21:00:00-0800
11/25/2021,8217.0,0.0,2021-11-25T21:00:00-0800
11/26/2021,9924.0,0.0,2021-11-26T20:50:26-0800
11/27/2021,6124.0,0.0,2021-11-27T20:48:51-0800
11/28/2021,9691.0,0.0,2021-11-28T20:42:45-0800
11/29/2021,6969.0,0.0,2021-11-29T20:58:12-0800
11/30/2021,12165.0,0.0,2021-11-30T20:57:08-0800
12/01/2021,10794.0,0.0,2021-12-01T20:52:26-0800
12/02/2021,7259.0,0.0,2021-12-02T20:42:10-0800
12/03/2021,6978.0,0.0,2021-12-03T20:55:49-0800
12/04/2021,6440.0,0.0,2021-12-04T20:59:42-0800
12/05/2021,9809.0,0.0,2021-12-05T20:57:16-0800
12/06/2021,12535.0,0.0,2021-12-06T20:58:45-0800
12/07/2021,12843.0,0.0,2021-12-07T20:30:39-0800
12/08/2021,9172.0,0.0,2021-12-08T21:00:00-0800
12/09/2021,12652.0,0.0,2021-12-09T20:46:00-0800
12/10/2021,6817.0,0.0,2021-12-10T20:56:30-0800
12/11/2021,9817.0,0.0,2021-12-11T20:46:35-0800
12/12/2021,11059.0,0.0,2021-12-12T20:22:20-0800
12/13/2021,10464.0,0.0,2021-12-13T20:48:00-0800
12/14/2021,3103.0,0.0,2021-12-14T20:29:52-0800
12/15/2021,8203.0,0.0,2021-12-15T20:53:51-0800
12/16/2021,9081.0,0.0,2021-12-16T20:07:13-0800
12/17/2021,18445.0,0.0,2021-12-17T21:00:00-0800
12/18/2021,17484.0,0.0,2021-12-18T20:49:26-0800
12/19/2021,6142.0,0.0,2021-12-19T20:59:01-0800
12/20/2021,11567.0,0.0,2021-12-20T20:40:25-0800
12/21/2021,8245.0,0.0,2021-12-21T21:00:00-0800
12/22/2021,9389.0,0.0,2021-12-22T21:00:00-0800
12/23/2021,10824.0,0.0,2021-12-23T20:59:23-0800
12/24/2021,11189.0,0.0,2021-12-24T20:56:23-0800
12/25/2021,7571.0,0.0,2021-12-25T20:58:11-0800
12/26/2021,8599.0,0.0,2021-12-26T20:57:06-0800
12/27/2021,9301.0,0.0,2021-12-27T21:00:00-0800
12/28/2021,10295.0,0.0,2021-12-28T21:00:00-0800
12/29/2021,10901.0,0.0,2021-12-29T20:57:23-0800
12/30/2021,11150.0,0.0,2021-12-30T20:59:44-0800
12/31/2021,7354.0,0.0,2021-12-31T13:11:28-0800
01/01/2022,9145.0,0.0,2022-01-01T22:15:58-0800
01/02/2022,10361.0,0.0,2022-01-02T21:53:59-0800
01/03/2022,10874.0,0.0,2022-01-03T20:51:38-0800
01/04/2022,11079.0,0.0,2022-01-04T21:09:18-0800
01/05/2022,11243.0,0.0,2022-01-05T21:30:16-0800
01/06/2022,11202.0,0.0,2022-01-06T22:25:31-0800
01/07/2022,7118.0,0.0,2022-01-07T22:44:09-0800
01/08/2022,7081.0,0.0,2022-01-08T23:53:18-0800
01/09/2022,8983.0,0.0,2022-01-09T23:37:32-0800
01/10/2022,9075.0,0.0,2022-01-10T12:13:06-0800
01/11/2022,4166.0,0.0,2022-01-11T17:02:42-0800
01/12/2022,8200.0,0.0,2022-01-13T00:00:00-0800
01/13/2022,6981.0,0.0,2022-01-14T00:00:00-0800
01/14/2022,11488.0,0.0,2022-01-14T23:36:01-0800
01/15/2022,7519.0,0.0,2022-01-15T23:48:12-0800
01/16/2022,13912.0,0.0,2022-01-16T23:59:37-0800
01/17/2022,9016.0,0.0,2022-01-17T23:54:14-0800
01/18/2022,10418.0,0.0,2022-01-18T21:10:32-0800
01/19/2022,5974.0,0.0,2022-01-19T23:59:01-0800
01/20/2022,8005.0,0.0,2022-01-20T23:33:12-0800
01/21/2022,9609.0,0.0,2022-01-21T23:08:57-0800
01/22/2022,8640.0,0.0,2022-01-22T20:33:00-0800
01/23/2022,5824.0,0.0,2022-01-23T23:09:45-0800
01/24/2022,8453.0,0.0,2022-01-24T23:58:49-0800
01/25/2022,8635.0,0.0,2022-01-25T22:17:27-0800
01/26/2022,4520.0,0.0,2022-01-26T21:43:31-0800
01/27/2022,9404.0,0.0,2022-01-27T23:50:00-0800
01/28/2022,2149.0,0.0,2022-01-29T00:00:00-0800
01/29/2022,13114.0,0.0,2022-01-29T23:46:02-0800
01/30/2022,7872.0,0.0,2022-01-30T22:13:36-0800
01/31/2022,9625.0,0.0,2022-01-31T23:16:13-0800
02/01/2022,14366.0,0.0,2022-02-01T23:53:00-0800
02/02/2022,8645.0,0.0,2022-02-02T21:35:01-0800
02/03/2022,1966.0,0.0,2022-02-03T21:41:01-0800
02/04/2022,8924.0,0.0,2022-02-04T23:58:37-0800
02/05/2022,11420.0,0.0,2022-02-05T22:22:44-0800
02/06/2022,2972.0,0.0,2022-02-06T22:50:07-0800
02/07/2022,7973.0,0.0,2022-02-07T23:53:44-0800
02/08/2022,8930.0,0.0,2022-02-08T23:50:31-0800
02/09/2022,6971.0,0.0,2022-02-09T23:49:24-0800
02/10/2022,8515.0,0.0,2022-02-10T23:57:00-0800
02/11/2022,9571.0,0.0,2022-02-11T23:41:23-0800
02/12/2022,12240.0,0.0,2022-02-12T23:18:39-0800
02/13/2022,7377.0,0.0,2022-02-13T23:14:22-0800
02/14/2022,12658.0,0.0,2022-02-15T00:00:00-0800
02/15/2022,11968.0,0.0,2022-02-16T00:00:00-0800
02/16/2022,8275.0,0.0,2022-02-16T23:28:52-0800
02/17/2022,9004.0,0.0,2022-02-17T23:35:46-0800
02/18/2022,5938.0,0.0,2022-02-18T23:47:50-0800
02/19/2022,7079.0,0.0,2022-02-19T23:50:24-0800
02/20/2022,9239.0,0.0,2022-02-20T22:15:05-0800
02/21/2022,13098.0,0.0,2022-02-21T23:36:44-0800
02/22/2022,8064.0,0.0,2022-02-22T23:44:04-0800
02/23/2022,5954.0,0.0,2022-02-23T23:21:27-0800
02/24/2022,11282.0,0.0,2022-02-24T23:15:47-0800
02/25/2022,7526.0,0.0,2022-02-25T23:58:49-0800
02/26/2022,7544.0,0.0,2022-02-26T20:30:53-0800
02/27/2022,7596.0,0.0,2022-02-27T23:59:32-0800
02/28/2022,4288.0,0.0,2022-02-28T23:42:54-0800
03/01/2022,15380.0,0.0,2022-03-01T21:23:37-0800
03/02/2022,6710.0,0.0,2022-03-02T23:54:28-0800
03/03/2022,11256.0,0.0,2022-03-03T23:25:43-0800
03/04/2022,4073.0,0.0,2022-03-04T21:52:11-0800
03/05/2022,12779.0,0.0,2022-03-05T22:46:54-0800
03/06/2022,11160.0,0.0,2022-03-06T22:46:52-0800
03/07/2022,8254.0,0.0,2022-03-07T22:59:15-0800
03/08/2022,11166.0,0.0,2022-03-08T23:00:00-0800
03/09/2022,7245.0,0.0,2022-03-09T22:59:23-0800
03/10/2022,6495.0,0.0,2022-03-10T21:29:25-0800
03/11/2022,6897.0,0.0,2022-03-11T22:59:28-0800
03/12/2022,8997.0,0.0,2022-03-12T20:44:16-0800
03/13/2022,12723.0,0.0,2022-03-13T21:28:11-0800
03/14/2022,11855.0,0.0,2022-03-14T20:38:58-0800
03/15/2022,9820.0,0.0,2022-03-15T21:31:58-0800
03/16/2022,8522.0,0.0,2022-03-16T20:28:31-0800
03/17/2022,7145.0,0.0,2022-03-17T21:31:05-0800
03/18/2022,12853.0,0.0,2022-03-18T20:30:19-0800
03/19/2022,7327.0,0.0,2022-03-19T22:40:38-0800
03/20/2022,8325.0,0.0,2022-03-20T22:30:01-0800
03/21/2022,7088.0,0.0,2022-03-21T22:28:35-0800
03/22/2022,12031.0,0.0,2022-03-22T21:41:05-0800
03/23/2022,8093.0,0.0,2022-03-23T23:00:00-0800
03/24/2022,7512.0,0.0,2022-03-24T22:39:07-0800
03/25/2022,3091.0,0.0,2022-03-25T22:15:56-0800
03/26/2022,9170.0,0.0,2022-03-26T22:59:52-0800
03/27/2022,14334.0,0.0,2022-03-27T22:44:40-0800
03/28/2022,11834.0,0.0,2022-03-28T22:39:44-0800
03/29/2022,14300.0,0.0,2022-03-29T22:08:54-0800
03/30/2022,5692.0,0.0,2022-03-30T22:13:05-0800
03/31/2022,7844.0,0.0,2022-03-31T22:41:44-0800
04/01/2022,12318.0,0.0,2022-04-01T22:59:11-0800
04/02/2022,27225.0,0.0,2022-04-02T23:00:00-0800
04/03/2022,17996.0,0.0,2022-04-03T22:27:16-0800
04/04/2022,9072.0,0.0,2022-04-04T22:59:51-0800
04/05/2022,14652.0,0.0,2022-04-05T22:22:22-0800
04/06/2022,4964.0,0.0,2022-04-06T22:56:55-0800
04/07/2022,5776.0,0.0,2022-04-07T22:53:13-0800
04/08/2022,1484.0,0.0,2022-04-08T12:08:26-0800
04/09/2022,5340.0,0.0,2022-04-09T22:14:19-0800
04/10/2022,4202.0,0.0,2022-04-10T22:17:32-0800
04/11/2022,11374.0,0.0,2022-04-11T22:54:59-0800
04/12/2022,12138.0,0.0,2022-04-12T21:44:10-0800
04/13/2022,4282.0,0.0,2022-04-13T22:52:20-0800
04/14/2022,11282.0,0.0,2022-04-14T20:40:54-0800
04/15/2022,11514.0,0.0,2022-04-15T22:47:44-0800
04/16/2022,5414.0,0.0,2022-04-16T22:57:12-0800
04/17/2022,3074.0,0.0,2022-04-17T20:55:57-0800
04/18/2022,11702.0,0.0,2022-04-18T21:30:21-0800
04/19/2022,13540.0,0.0,2022-04-19T22:07:03-0800
04/20/2022,13678.0,0.0,2022-04-20T22:12:30-0800
04/21/2022,12426.0,0.0,2022-04-21T22:31:53-0800
04/22/2022,12.0,0.0,2022-04-21T23:04:08-0800
04/23/2022,12454.0,0.0,2022-04-23T22:44:00-0800
04/24/2022,8784.0,0.0,2022-04-24T22:47:37-0800
04/25/2022,10936.0,0.0,2022-04-25T22:42:45-0800
04/26/2022,10804.0,0.0,2022-04-26T17:29:56-0800
04/27/2022,5542.0,0.0,2022-04-27T22:22:14-0800
04/28/2022,4018.0,0.0,2022-04-28T08:30:24-0800
04/29/2022,4186.0,0.0,2022-04-29T22:57:01-0800
04/30/2022,11622.0,0.0,2022-04-30T22:34:26-0800
05/01/2022,9900.0,0.0,2022-05-01T22:45:08-0800
05/02/2022,4044.0,0.0,2022-05-02T21:05:20-0800
05/03/2022,14552.0,0.0,2022-05-03T22:35:18-0800
05/04/2022,150.0,0.0,2022-05-04T11:36:57-0800
05/05/2022,16.0,0.0,2022-05-04T23:15:32-0800
05/08/2022,5430.0,0.0,2022-05-08T20:18:23-0800
05/09/2022,11692.0,0.0,2022-05-09T20:58:25-0800
05/10/2022,14006.0,0.0,2022-05-10T21:48:16-0800
05/11/2022,10412.0,0.0,2022-05-11T22:25:20-0800
05/12/2022,18760.0,0.0,2022-05-12T22:32:46-0800
05/13/2022,8076.0,0.0,2022-05-13T21:52:32-0800
05/14/2022,13978.0,0.0,2022-05-14T22:27:54-0800
05/15/2022,8334.0,0.0,2022-05-15T21:42:03-0800
05/16/2022,11901.0,0.0,2022-05-16T07:33:18-0800
05/17/2022,14806.0,0.0,2022-05-17T07:29:52-0800
05/18/2022,5493.0,0.0,2022-05-18T08:15:19-0800
05/19/2022,15065.0,0.0,2022-05-19T07:53:27-0800
05/20/2022,8136.0,0.0,2022-05-20T07:27:26-0800
05/21/2022,13261.0,0.0,2022-05-21T22:55:43-0800
05/22/2022,8224.0,0.0,2022-05-22T17:38:06-0800
05/23/2022,11740.0,0.0,2022-05-23T23:00:00-0800
05/24/2022,11432.0,0.0,2022-05-24T22:47:40-0800
05/25/2022,14237.0,0.0,2022-05-25T22:21:28-0800
05/26/2022,9287.0,0.0,2022-05-26T21:54:08-0800
05/27/2022,14463.0,0.0,2022-05-27T22:08:02-0800
05/28/2022,6156.0,0.0,2022-05-28T22:34:30-0800
05/29/2022,5158.0,0.0,2022-05-29T22:16:44-0800
05/30/2022,10723.0,0.0,2022-05-30T21:52:26-0800
05/31/2022,8837.0,0.0,2022-05-31T23:00:00-0800
06/01/2022,12294.0,0.0,2022-06-01T21:11:11-0800
06/02/2022,5870.0,0.0,2022-06-02T22:25:20-0800
06/03/2022,13411.0,0.0,2022-06-03T20:50:09-0800
06/04/2022,26443.0,0.0,2022-06-04T22:55:06-0800
06/05/2022,20723.0,0.0,2022-06-05T22:31:49-0800
06/06/2022,5089.0,0.0,2022-06-06T08:00:14-0800
06/07/2022,2297.0,0.0,2022-06-07T08:01:40-0800
06/08/2022,10552.0,0.0,2022-06-08T22:36:22-0800
06/09/2022,2357.0,0.0,2022-06-09T22:46:09-0800
06/10/2022,9837.0,0.0,2022-06-10T22:40:47-0800
06/11/2022,14734.0,0.0,2022-06-11T22:28:22-0800
06/12/2022,12273.0,0.0,2022-06-12T20:27:45-0800
06/13/2022,12030.0,0.0,2022-06-13T13:47:12-0800
06/14/2022,12668.0,0.0,2022-06-14T07:25:54-0800
06/15/2022,12667.0,0.0,2022-06-15T07:52:52-0800
06/16/2022,9719.0,0.0,2022-06-16T07:35:49-0800
06/17/2022,11886.0,0.0,2022-06-17T07:27:39-0800
06/18/2022,10476.0,0.0,2022-06-18T09:30:05-0800
06/19/2022,10567.0,0.0,2022-06-19T09:13:30-0800
06/20/2022,14467.0,0.0,2022-06-20T07:10:39-0800
06/21/2022,16296.0,0.0,2022-06-21T07:10:33-0800
06/22/2022,10107.0,0.0,2022-06-21T23:39:13-0800
06/23/2022,7369.0,0.0,2022-06-23T00:00:42-0800
06/24/2022,16331.0,0.0,2022-06-23T23:29:04-0800
06/25/2022,15894.0,0.0,2022-06-24T23:35:26-0800
06/26/2022,8704.0,0.0,2022-06-26T13:49:58-0800
06/27/2022,12991.0,0.0,2022-06-26T23:11:08-0800
06/28/2022,12011.0,0.0,2022-06-28T07:25:16-0800
06/29/2022,10108.0,0.0,2022-06-29T07:37:37-0800
06/30/2022,13087.0,0.0,2022-06-30T07:08:16-0800
07/01/2022,13967.0,0.0,2022-07-01T00:06:23-0800
07/02/2022,15739.0,0.0,2022-07-01T23:28:53-0800
07/03/2022,9384.0,0.0,2022-07-03T08:38:22-0800
07/04/2022,23240.0,0.0,2022-07-04T08:04:40-0800
07/05/2022,16063.0,0.0,2022-07-05T22:31:21-0800
07/06/2022,9058.0,0.0,2022-07-06T21:48:22-0800
07/07/2022,8183.0,0.0,2022-07-07T22:57:13-0800
07/08/2022,22321.0,0.0,2022-07-08T22:36:17-0800
07/09/2022,4469.0,0.0,2022-07-09T22:20:50-0800
07/10/2022,92.0,0.0,2022-07-10T09:20:33-0800
08/28/2022,14724.0,0.0,2022-08-28T21:27:41-0800
08/29/2022,9885.0,0.0,2022-08-29T07:11:40-0800
08/30/2022,12646.0,0.0,2022-08-30T22:42:29-0800
08/31/2022,10354.0,0.0,2022-08-31T22:46:40-0800
09/01/2022,14033.0,0.0,2022-09-01T07:10:34-0800
09/02/2022,13354.0,0.0,2022-09-02T21:58:39-0800
09/03/2022,10477.0,0.0,2022-09-03T21:08:20-0800
09/04/2022,7860.0,0.0,2022-09-04T21:40:48-0800
09/05/2022,10002.0,0.0,2022-09-05T08:51:17-0800
09/06/2022,11954.0,0.0,2022-09-06T07:00:32-0800
09/07/2022,12464.0,0.0,2022-09-07T06:43:25-0800
09/08/2022,6313.0,0.0,2022-09-08T07:02:39-0800
09/09/2022,14748.0,0.0,2022-09-09T22:34:10-0800
09/10/2022,11604.0,0.0,2022-09-10T22:53:18-0800
09/11/2022,12029.0,0.0,2022-09-11T22:45:17-0800
09/12/2022,11367.0,0.0,2022-09-12T22:50:32-0800
09/13/2022,12111.0,0.0,2022-09-13T22:49:22-0800
09/14/2022,12903.0,0.0,2022-09-14T22:54:48-0800
09/15/2022,16114.0,0.0,2022-09-15T22:53:37-0800
09/16/2022,3566.0,0.0,2022-09-16T22:45:15-0800
09/17/2022,7912.0,0.0,2022-09-17T22:59:01-0800
09/18/2022,13866.0,0.0,2022-09-18T22:36:19-0800
09/19/2022,12223.0,0.0,2022-09-19T21:22:43-0800
09/20/2022,11691.0,0.0,2022-09-20T19:48:24-0800
09/21/2022,12465.0,0.0,2022-09-21T22:23:37-0800
09/22/2022,3612.0,0.0,2022-09-22T21:49:17-0800
09/23/2022,8047.0,0.0,2022-09-23T22:21:45-0800
09/24/2022,7537.0,0.0,2022-09-24T21:22:43-0800
09/25/2022,5931.0,0.0,2022-09-25T22:57:28-0800
09/26/2022,1217.0,0.0,2022-09-26T22:44:32-0800
09/27/2022,9274.0,0.0,2022-09-27T20:35:20-0800
09/28/2022,12254.0,0.0,2022-09-28T22:47:21-0800
09/29/2022,1927.0,0.0,2022-09-29T22:38:16-0800
09/30/2022,2623.0,0.0,2022-09-30T22:19:27-0800
10/01/2022,20658.0,0.0,2022-10-01T12:22:21-0800
10/02/2022,28170.0,0.0,2022-10-02T14:05:39-0800
10/03/2022,24749.0,0.0,2022-10-03T14:33:44-0800
10/04/2022,10332.0,0.0,2022-10-04T22:55:35-0800
10/05/2022,11886.0,0.0,2022-10-05T12:55:37-0800
10/06/2022,17997.0,0.0,2022-10-06T13:39:44-0800
10/07/2022,13935.0,0.0,2022-10-07T13:13:03-0800
10/08/2022,20749.0,0.0,2022-10-08T22:49:42-0800
10/09/2022,9663.0,0.0,2022-10-09T18:11:26-0800
10/10/2022,9744.0,0.0,2022-10-10T07:51:47-0800
10/11/2022,9308.0,0.0,2022-10-11T06:57:48-0800
10/12/2022,12333.0,0.0,2022-10-12T07:07:03-0800
10/13/2022,13217.0,0.0,2022-10-13T06:51:10-0800
10/14/2022,13202.0,0.0,2022-10-14T07:07:24-0800
10/15/2022,6667.0,0.0,2022-10-15T09:15:49-0800
10/16/2022,10908.0,0.0,2022-10-15T23:02:22-0800
10/17/2022,12243.0,0.0,2022-10-17T07:01:11-0800
10/18/2022,13386.0,0.0,2022-10-18T18:59:27-0800
10/19/2022,3781.0,0.0,2022-10-19T07:32:13-0800
10/20/2022,2431.0,0.0,2022-10-20T07:31:01-0800
10/21/2022,7247.0,0.0,2022-10-21T07:48:01-0800
10/22/2022,11333.0,0.0,2022-10-22T08:31:09-0800
10/23/2022,11489.0,0.0,2022-10-22T23:16:19-0800
10/24/2022,7225.0,0.0,2022-10-24T07:22:49-0800
10/25/2022,12888.0,0.0,2022-10-25T08:05:25-0800
10/26/2022,11886.0,0.0,2022-10-25T23:19:11-0800
10/27/2022,14235.0,0.0,2022-10-27T12:31:44-0800
10/28/2022,8420.0,0.0,2022-10-28T13:44:38-0800
10/29/2022,18632.0,0.0,2022-10-29T09:02:35-0800
10/30/2022,10736.0,0.0,2022-10-30T09:19:08-0800
10/31/2022,13717.0,0.0,2022-10-31T07:12:47-0800
11/01/2022,13577.0,0.0,2022-11-01T18:54:02-0800
11/02/2022,7428.0,0.0,2022-11-02T07:08:29-0800
11/03/2022,10512.0,0.0,2022-11-03T07:32:33-0800
11/04/2022,11120.0,0.0,2022-11-04T19:19:29-0800
11/05/2022,10137.0,0.0,2022-11-05T09:48:39-0800
11/06/2022,8792.0,0.0,2022-11-05T23:14:42-0800
11/07/2022,10838.0,0.0,2022-11-07T07:41:24-0800
11/08/2022,12640.0,0.0,2022-11-08T20:24:39-0800
01/11/2023,601.0,0.0,2023-01-11T22:59:06-0800
01/12/2023,9581.0,0.0,2023-01-12T22:48:21-0800
01/13/2023,10561.0,0.0,2023-01-13T20:23:05-0800
01/14/2023,7708.0,0.0,2023-01-14T20:31:16-0800
01/15/2023,11126.0,0.0,2023-01-15T22:58:17-0800
01/16/2023,7860.0,0.0,2023-01-16T22:57:18-0800
01/17/2023,4257.0,0.0,2023-01-17T22:59:11-0800
01/18/2023,6111.0,0.0,2023-01-18T21:46:16-0800
01/19/2023,10647.0,0.0,2023-01-19T22:55:30-0800
01/20/2023,7889.0,0.0,2023-01-20T22:51:10-0800
01/21/2023,7799.0,0.0,2023-01-21T22:51:28-0800
01/22/2023,8232.0,0.0,2023-01-22T22:58:43-0800
01/23/2023,7484.0,0.0,2023-01-23T22:23:37-0800
01/24/2023,4677.0,0.0,2023-01-24T22:58:07-0800
01/25/2023,11618.0,0.0,2023-01-25T22:39:07-0800
01/26/2023,8294.0,0.0,2023-01-26T22:58:14-0800
01/27/2023,8501.0,0.0,2023-01-27T21:03:19-0800
01/28/2023,16728.0,0.0,2023-01-28T22:44:17-0800
01/29/2023,10372.0,0.0,2023-01-29T22:59:02-0800
01/30/2023,11509.0,0.0,2023-01-30T20:24:09-0800
01/31/2023,12310.0,0.0,2023-01-31T22:58:22-0800
02/01/2023,8864.0,0.0,2023-02-01T22:53:11-0800
02/02/2023,13921.0,0.0,2023-02-02T22:27:15-0800
02/03/2023,4848.0,0.0,2023-02-03T22:47:10-0800
02/04/2023,5039.0,0.0,2023-02-04T20:54:23-0800
02/05/2023,222.0,0.0,2023-02-05T22:01:19-0800
02/07/2023,12646.0,0.0,2023-02-07T22:57:49-0800
02/08/2023,5907.0,0.0,2023-02-08T21:21:11-0800
02/09/2023,9241.0,0.0,2023-02-09T22:42:08-0800
02/10/2023,9910.0,0.0,2023-02-10T21:55:46-0800
02/11/2023,8491.0,0.0,2023-02-11T22:08:36-0800
02/12/2023,3318.0,0.0,2023-02-12T22:15:25-0800
02/13/2023,10922.0,0.0,2023-02-13T22:28:10-0800
02/14/2023,11707.0,0.0,2023-02-14T22:09:35-0800
02/15/2023,10847.0,0.0,2023-02-15T20:22:17-0800
02/16/2023,13357.0,0.0,2023-02-16T22:46:19-0800
02/17/2023,6201.0,0.0,2023-02-17T22:36:12-0800
02/18/2023,15218.0,0.0,2023-02-18T22:11:30-0800
02/19/2023,14635.0,0.0,2023-02-19T21:42:10-0800
02/20/2023,5982.0,0.0,2023-02-20T22:58:14-0800
02/21/2023,11231.0,0.0,2023-02-21T22:14:11-0800
02/22/2023,5293.0,0.0,2023-02-22T22:25:27-0800
02/23/2023,12916.0,0.0,2023-02-23T22:44:28-0800
02/24/2023,11225.0,0.0,2023-02-24T22:47:16-0800
02/25/2023,6716.0,0.0,2023-02-25T22:20:07-0800
02/26/2023,16153.0,0.0,2023-02-26T21:08:09-0800
02/27/2023,9068.0,0.0,2023-02-27T22:38:13-0800
02/28/2023,101.0,0.0,2023-02-28T22:45:11-0800
03/12/2023,6547.0,0.0,2023-03-12T21:08:10-0800
03/13/2023,14082.0,0.0,2023-03-13T15:00:47-0800
03/14/2023,13575.0,0.0,2023-03-14T18:50:13-0800
03/15/2023,12402.0,0.0,2023-03-15T10:41:12-0800
03/16/2023,16711.0,0.0,2023-03-15T23:51:17-0800
03/17/2023,4696.0,0.0,2023-03-17T08:01:18-0800
03/18/2023,12664.0,0.0,2023-03-18T21:53:26-0800
03/19/2023,132.0,0.0,2023-03-18T23:20:36-0800
04/05/2023,9956.0,0.0,2023-04-05T22:30:23-0800
04/06/2023,11311.0,0.0,2023-04-06T22:03:12-0800
04/07/2023,15372.0,0.0,2023-04-07T22:30:23-0800
04/08/2023,22627.0,0.0,2023-04-08T22:08:02-0800
04/09/2023,14236.0,0.0,2023-04-09T22:09:10-0800
04/10/2023,12372.0,0.0,2023-04-10T21:35:11-0800
04/11/2023,7609.0,0.0,2023-04-11T21:57:10-0800
04/12/2023,13152.0,0.0,2023-04-12T21:04:25-0800
04/13/2023,2903.0,0.0,2023-04-12T23:03:17-0800
04/14/2023,15489.0,0.0,2023-04-13T23:14:09-0800
04/15/2023,2909.0,0.0,2023-04-14T23:07:25-0800
04/16/2023,9421.0,0.0,2023-04-16T22:32:52-0800
04/17/2023,11013.0,0.0,2023-04-17T19:04:01-0800
04/18/2023,10285.0,0.0,2023-04-18T19:55:18-0800
04/19/2023,5893.0,0.0,2023-04-19T14:59:07-0800
04/20/2023,9616.0,0.0,2023-04-20T06:59:19-0800
04/21/2023,7441.0,0.0,2023-04-21T18:49:08-0800
04/22/2023,6889.0,0.0,2023-04-21T23:05:17-0800
04/23/2023,5536.0,0.0,2023-04-23T00:42:13-0800
04/24/2023,10444.0,0.0,2023-04-24T18:14:35-0800
04/25/2023,10330.0,0.0,2023-04-25T20:09:28-0800
04/26/2023,10922.0,0.0,2023-04-25T23:02:09-0800
04/27/2023,22042.0,0.0,2023-04-27T16:48:15-0800
04/28/2023,16641.0,0.0,2023-04-28T16:55:06-0800
04/29/2023,11836.0,0.0,2023-04-29T14:24:21-0800
04/30/2023,10452.0,0.0,2023-04-30T16:18:51-0800
05/01/2023,9677.0,0.0,2023-05-01T22:58:11-0800
05/02/2023,11162.0,0.0,2023-05-02T21:55:22-0800
05/03/2023,12178.0,0.0,2023-05-03T22:17:11-0800
05/04/2023,7134.0,0.0,2023-05-04T22:28:24-0800
05/05/2023,2981.0,0.0,2023-05-05T22:24:24-0800
05/06/2023,17011.0,0.0,2023-05-06T22:51:24-0800
05/07/2023,8326.0,0.0,2023-05-07T16:53:15-0800
05/08/2023,10220.0,0.0,2023-05-08T15:00:20-0800
05/09/2023,10345.0,0.0,2023-05-09T22:34:17-0800
05/10/2023,10755.0,0.0,2023-05-09T23:18:15-0800
05/11/2023,3743.0,0.0,2023-05-11T22:43:25-0800
05/12/2023,13272.0,0.0,2023-05-12T22:11:13-0800
05/13/2023,11956.0,0.0,2023-05-13T22:10:13-0800
05/14/2023,9479.0,0.0,2023-05-13T23:53:29-0800
05/15/2023,10522.0,0.0,2023-05-15T20:57:17-0800
05/16/2023,16.0,0.0,2023-05-15T23:16:16-0800
05/17/2023,9383.0,0.0,2023-05-17T21:25:11-0800
05/18/2023,9838.0,0.0,2023-05-18T21:19:12-0800
05/19/2023,7022.0,0.0,2023-05-19T22:58:15-0800
05/20/2023,13728.0,0.0,2023-05-20T21:38:24-0800
05/21/2023,8769.0,0.0,2023-05-21T22:23:11-0800
05/22/2023,10331.0,0.0,2023-05-21T23:39:15-0800
05/23/2023,15174.0,0.0,2023-05-23T22:54:12-0800
05/24/2023,13614.0,0.0,2023-05-24T22:48:11-0800
05/25/2023,11818.0,0.0,2023-05-24T23:47:23-0800
05/26/2023,6850.0,0.0,2023-05-26T20:56:12-0800
05/27/2023,17968.0,0.0,2023-05-26T22:22:27-0800
05/28/2023,16493.0,0.0,2023-05-28T20:25:23-0800
05/29/2023,16077.0,0.0,2023-05-29T20:42:24-0800
05/30/2023,301.0,0.0,2023-05-30T07:09:15-0800
05/31/2023,7633.0,0.0,2023-05-31T20:09:10-0800
06/01/2023,11951.0,0.0,2023-06-01T20:25:15-0800
06/02/2023,5040.0,0.0,2023-06-02T20:50:18-0800
06/04/2023,8569.0,0.0,2023-06-03T23:24:21-0800
06/05/2023,10114.0,0.0,2023-06-04T23:15:09-0800
06/06/2023,15306.0,0.0,2023-06-06T22:40:15-0800
06/07/2023,2844.0,0.0,2023-06-07T22:37:14-0800
06/09/2023,10625.0,0.0,2023-06-08T23:18:09-0800
06/10/2023,3775.0,0.0,2023-06-09T23:41:30-0800
06/11/2023,8982.0,0.0,2023-06-10T23:33:17-0800
06/12/2023,23027.0,0.0,2023-06-11T23:28:30-0800
06/13/2023,11131.0,0.0,2023-06-12T23:43:44-0800
06/14/2023,10499.0,0.0,2023-06-13T23:09:06-0800
06/15/2023,6905.0,0.0,2023-06-14T23:45:06-0800
06/16/2023,13595.0,0.0,2023-06-15T23:12:10-0800
06/17/2023,10129.0,0.0,2023-06-16T23:43:45-0800
06/18/2023,6526.0,0.0,2023-06-17T23:33:09-0800
06/19/2023,7075.0,0.0,2023-06-18T23:23:10-0800
06/20/2023,5633.0,0.0,2023-06-19T23:40:07-0800
06/21/2023,13468.0,0.0,2023-06-20T23:39:24-0800
06/22/2023,6717.0,0.0,2023-06-21T23:20:05-0800
06/23/2023,8514.0,0.0,2023-06-22T23:11:07-0800
06/24/2023,11301.0,0.0,2023-06-23T23:19:27-0800
06/25/2023,16980.0,0.0,2023-06-24T23:19:09-0800
06/27/2023,12627.0,0.0,2023-06-26T23:09:22-0800
06/28/2023,13302.0,0.0,2023-06-27T23:23:25-0800
06/29/2023,3649.0,0.0,2023-06-28T23:00:43-0800
06/30/2023,9927.0,0.0,2023-06-29T23:10:21-0800
07/01/2023,13708.0,0.0,2023-06-30T23:00:16-0800
07/02/2023,11514.0,0.0,2023-07-01T23:55:22-0800
07/03/2023,5603.0,0.0,2023-07-02T23:13:12-0800
07/05/2023,4621.0,0.0,2023-07-04T23:23:12-0800
07/07/2023,14885.0,0.0,2023-07-06T23:44:09-0800
07/09/2023,14828.0,0.0,2023-07-08T23:18:39-0800
07/10/2023,2933.0,0.0,2023-07-09T23:13:08-0800
07/12/2023,14663.0,0.0,2023-07-11T23:10:06-0800
07/13/2023,19397.0,0.0,2023-07-12T23:03:49-0800
07/14/2023,12005.0,0.0,2023-07-14T22:48:11-0800
07/15/2023,9232.0,0.0,2023-07-15T22:22:24-0800
07/16/2023,11089.0,0.0,2023-07-16T22:19:20-0800
07/18/2023,7222.0,0.0,2023-07-17T23:43:09-0800
07/20/2023,3333.0,0.0,2023-07-19T23:55:12-0800
07/21/2023,13054.0,0.0,2023-07-20T23:29:24-0800
07/22/2023,5531.0,0.0,2023-07-21T23:30:51-0800
07/23/2023,9110.0,0.0,2023-07-22T23:52:06-0800
07/25/2023,18166.0,0.0,2023-07-24T23:09:57-0800
07/27/2023,15451.0,0.0,2023-07-26T23:19:10-0800
07/28/2023,24842.0,0.0,2023-07-27T23:04:24-0800
07/30/2023,4131.0,0.0,2023-07-29T23:15:20-0800
08/01/2023,16537.0,0.0,2023-07-31T23:07:14-0800
08/02/2023,14491.0,0.0,2023-08-01T23:48:12-0800
08/03/2023,12284.0,0.0,2023-08-02T23:56:06-0800
08/04/2023,11062.0,0.0,2023-08-04T21:39:15-0800
08/06/2023,7831.0,0.0,2023-08-05T23:58:12-0800
08/07/2023,13063.0,0.0,2023-08-07T19:48:13-0800
08/08/2023,21909.0,0.0,2023-08-08T19:04:11-0800
08/09/2023,16039.0,0.0,2023-08-09T19:37:12-0800
08/10/2023,11076.0,0.0,2023-08-10T18:26:12-0800
08/11/2023,19277.0,0.0,2023-08-11T18:33:11-0800
08/12/2023,28244.0,0.0,2023-08-12T22:55:42-0800
08/13/2023,7815.0,0.0,2023-08-13T19:36:14-0800
08/14/2023,7402.0,0.0,2023-08-14T20:25:07-0800
08/15/2023,791.0,0.0,2023-08-15T13:32:12-0800
11/26/2023,15169.0,0.0,2023-11-26T22:58:21-0800
11/27/2023,12905.0,0.0,2023-11-27T17:30:17-0800
11/28/2023,13722.0,0.0,2023-11-28T08:02:06-0800
11/29/2023,12070.0,0.0,2023-11-29T10:10:10-0800
11/30/2023,7140.0,0.0,2023-11-30T16:15:02-0800
12/01/2023,8373.0,0.0,2023-12-01T00:29:12-0800
12/02/2023,12399.0,0.0,2023-12-02T23:06:21-0800
12/03/2023,9126.0,0.0,2023-12-03T22:36:14-0800
12/04/2023,3947.0,0.0,2023-12-04T21:54:15-0800
12/05/2023,10292.0,0.0,2023-12-05T22:13:22-0800
12/06/2023,3151.0,0.0,2023-12-06T00:39:10-0800
12/07/2023,10266.0,0.0,2023-12-07T23:13:11-0800
12/08/2023,14262.0,0.0,2023-12-08T22:45:35-0800
12/09/2023,10495.0,0.0,2023-12-09T00:40:16-0800
12/10/2023,10961.0,0.0,2023-12-10T20:56:46-0800
12/11/2023,13260.0,0.0,2023-12-11T20:41:11-0800
12/12/2023,12892.0,0.0,2023-12-12T19:16:27-0800
12/13/2023,18124.0,0.0,2023-12-13T20:52:27-0800
12/14/2023,10456.0,0.0,2023-12-14T20:53:46-0800
12/15/2023,4446.0,0.0,2023-12-15T20:59:45-0800
12/16/2023,13240.0,0.0,2023-12-16T00:01:19-0800
12/17/2023,7901.0,0.0,2023-12-16T22:18:15-0800
12/18/2023,4637.0,0.0,2023-12-18T20:01:20-0800
12/19/2023,4687.0,0.0,2023-12-19T20:52:11-0800
12/20/2023,11741.0,0.0,2023-12-20T20:55:11-0800
12/21/2023,11925.0,0.0,2023-12-21T20:19:26-0800
12/22/2023,13643.0,0.0,2023-12-22T20:28:08-0800
12/23/2023,6976.0,0.0,2023-12-22T22:27:10-0800
12/24/2023,5168.0,0.0,2023-12-23T22:18:51-0800
12/25/2023,10027.0,0.0,2023-12-24T22:05:25-0800
12/26/2023,7468.0,0.0,2023-12-25T21:36:13-0800
12/27/2023,10644.0,0.0,2023-12-27T20:10:30-0800
12/28/2023,11082.0,0.0,2023-12-27T21:28:15-0800
12/29/2023,10565.0,0.0,2023-12-29T20:52:19-0800
12/30/2023,7980.0,0.0,2023-12-30T20:33:05-0800
12/31/2023,10310.0,0.0,2023-12-31T20:59:29-0800
01/01/2024,10591.0,0.0,2024-01-01T19:56:15-0800
01/02/2024,10353.0,0.0,2024-01-01T21:15:18-0800
01/03/2024,8959.0,0.0,2024-01-03T20:54:25-0800
01/04/2024,4610.0,0.0,2024-01-04T20:40:10-0800
01/05/2024,7142.0,0.0,2024-01-05T22:30:15-0800
01/06/2024,5192.0,0.0,2024-01-06T23:39:19-0800
01/07/2024,10243.0,0.0,2024-01-07T16:25:35-0800
01/08/2024,13657.0,0.0,2024-01-08T23:52:10-0800
01/09/2024,12198.0,0.0,2024-01-09T23:59:13-0800
01/10/2024,5235.0,0.0,2024-01-10T23:49:44-0800
01/11/2024,13146.0,0.0,2024-01-11T22:56:07-0800
01/12/2024,2293.0,0.0,2024-01-12T23:18:38-0800
01/13/2024,8243.0,0.0,2024-01-13T23:46:18-0800
01/14/2024,5184.0,0.0,2024-01-14T12:53:07-0800
01/15/2024,8525.0,0.0,2024-01-15T19:49:08-0800
01/16/2024,11633.0,0.0,2024-01-16T00:24:42-0800
01/17/2024,3896.0,0.0,2024-01-17T00:09:27-0800
01/18/2024,11046.0,0.0,2024-01-18T07:57:15-0800
01/19/2024,11511.0,0.0,2024-01-19T00:08:15-0800
01/20/2024,7773.0,0.0,2024-01-20T21:47:16-0800
01/21/2024,7911.0,0.0,2024-01-21T01:37:11-0800
01/22/2024,13517.0,0.0,2024-01-22T20:07:19-0800
01/23/2024,12914.0,0.0,2024-01-23T13:06:15-0800
01/24/2024,5423.0,0.0,2024-01-24T00:04:12-0800
01/25/2024,11959.0,0.0,2024-01-25T21:52:11-0800
01/26/2024,12138.0,0.0,2024-01-26T00:31:10-0800
01/27/2024,9203.0,0.0,2024-01-27T00:25:34-0800
01/28/2024,16401.0,0.0,2024-01-28T00:41:17-0800
01/29/2024,12443.0,0.0,2024-01-29T18:08:14-0800
01/30/2024,11589.0,0.0,2024-01-30T19:55:23-0800
01/31/2024,9112.0,0.0,2024-01-31T00:30:11-0800
02/01/2024,12107.0,0.0,2024-02-01T16:58:23-0800
02/02/2024,10069.0,0.0,2024-02-02T11:32:16-0800
02/03/2024,13952.0,0.0,2024-02-03T08:45:07-0800
02/04/2024,7197.0,0.0,2024-02-04T18:43:10-0800
02/05/2024,12700.0,0.0,2024-02-05T07:55:12-0800
02/06/2024,14818.0,0.0,2024-02-06T00:11:21-0800
02/07/2024,5385.0,0.0,2024-02-07T16:15:10-0800
02/08/2024,13262.0,0.0,2024-02-08T15:34:40-0800
02/09/2024,5661.0,0.0,2024-02-09T13:08:02-0800
02/10/2024,12390.0,0.0,2024-02-10T00:52:16-0800
02/11/2024,5732.0,0.0,2024-02-11T09:54:30-0800
02/12/2024,8033.0,0.0,2024-02-12T23:37:20-0800
02/13/2024,13929.0,0.0,2024-02-13T19:25:13-0800
02/14/2024,12512.0,0.0,2024-02-14T21:58:08-0800
02/15/2024,14435.0,0.0,2024-02-15T20:53:25-0800
02/16/2024,3142.0,0.0,2024-02-16T21:46:35-0800
02/17/2024,5850.0,0.0,2024-02-17T21:50:23-0800
02/18/2024,16226.0,0.0,2024-02-18T21:44:25-0800
02/19/2024,12042.0,0.0,2024-02-19T20:23:30-0800
02/20/2024,8245.0,0.0,2024-02-20T20:57:55-0800
02/21/2024,8579.0,0.0,2024-02-21T21:33:45-0800
02/22/2024,13.0,0.0,2024-02-21T22:36:13-0800
02/23/2024,10824.0,0.0,2024-02-23T21:23:12-0800
02/24/2024,4242.0,0.0,2024-02-24T22:07:12-0800
02/25/2024,8412.0,0.0,2024-02-25T23:26:14-0800
02/26/2024,13083.0,0.0,2024-02-26T18:21:58-0800
02/27/2024,11177.0,0.0,2024-02-27T14:17:42-0800
02/28/2024,4220.0,0.0,2024-02-28T00:03:33-0800
02/29/2024,12755.0,0.0,2024-02-29T00:21:19-0800
03/01/2024,4359.0,0.0,2024-03-01T01:25:29-0800
03/02/2024,11246.0,0.0,2024-03-02T09:42:07-0800
03/03/2024,5439.0,0.0,2024-03-03T00:38:08-0800
03/04/2024,8060.0,0.0,2024-03-04T08:37:16-0800
03/05/2024,13180.0,0.0,2024-03-05T00:29:11-0800
03/06/2024,8715.0,0.0,2024-03-06T00:03:16-0800
03/07/2024,12389.0,0.0,2024-03-07T00:11:50-0800
03/08/2024,11997.0,0.0,2024-03-08T00:20:13-0800
03/09/2024,6626.0,0.0,2024-03-09T00:31:48-0800
03/10/2024,7601.0,0.0,2024-03-10T22:03:17-0800
03/11/2024,13182.0,0.0,2024-03-10T23:17:06-0800
03/12/2024,12551.0,0.0,2024-03-11T23:16:15-0800
03/13/2024,6909.0,0.0,2024-03-13T10:56:14-0800
03/14/2024,7372.0,0.0,2024-03-13T23:05:09-0800
03/15/2024,10909.0,0.0,2024-03-14T23:10:58-0800
03/16/2024,25556.0,0.0,2024-03-15T23:39:08-0800
03/17/2024,10648.0,0.0,2024-03-16T23:05:06-0800
03/18/2024,13332.0,0.0,2024-03-18T07:57:05-0800
03/19/2024,14594.0,0.0,2024-03-18T23:33:15-0800
03/20/2024,7746.0,0.0,2024-03-19T23:06:08-0800
03/21/2024,13596.0,0.0,2024-03-21T07:49:59-0800
03/22/2024,15099.0,0.0,2024-03-21T23:13:11-0800
03/23/2024,22294.0,0.0,2024-03-23T22:23:07-0800
03/24/2024,16659.0,0.0,2024-03-24T21:21:45-0800
03/25/2024,16418.0,0.0,2024-03-25T22:38:41-0800
03/26/2024,13733.0,0.0,2024-03-26T22:59:54-0800
03/27/2024,9086.0,0.0,2024-03-27T22:05:15-0800
03/28/2024,13125.0,0.0,2024-03-28T22:56:22-0800
03/29/2024,7439.0,0.0,2024-03-29T22:53:27-0800
03/30/2024,15017.0,0.0,2024-03-30T22:40:16-0800
03/31/2024,12523.0,0.0,2024-03-31T22:49:49-0800
04/01/2024,12231.0,0.0,2024-04-01T19:42:14-0800
04/02/2024,4036.0,0.0,2024-04-01T23:29:15-0800
04/03/2024,9586.0,0.0,2024-04-03T19:59:30-0800
04/04/2024,10341.0,0.0,2024-04-04T19:56:08-0800
04/05/2024,4931.0,0.0,2024-04-05T19:47:12-0800
04/06/2024,3904.0,0.0,2024-04-06T19:44:14-0800
04/07/2024,8395.0,0.0,2024-04-07T19:51:30-0800
04/08/2024,11135.0,0.0,2024-04-07T20:23:20-0800
04/09/2024,5463.0,0.0,2024-04-09T17:14:14-0800
04/10/2024,4478.0,0.0,2024-04-09T20:25:14-0800
04/11/2024,4269.0,0.0,2024-04-10T20:05:17-0800
04/12/2024,7500.0,0.0,2024-04-12T20:24:55-0800
04/13/2024,15526.0,0.0,2024-04-12T23:40:07-0800
04/14/2024,13180.0,0.0,2024-04-14T22:59:12-0800
04/15/2024,14303.0,0.0,2024-04-15T22:54:05-0800
04/16/2024,16174.0,0.0,2024-04-16T22:47:06-0800
04/17/2024,11796.0,0.0,2024-04-17T09:18:10-0800
04/18/2024,13149.0,0.0,2024-04-18T12:11:19-0800
04/19/2024,13005.0,0.0,2024-04-18T23:20:26-0800
04/20/2024,16412.0,0.0,2024-04-20T22:59:33-0800
04/21/2024,16471.0,0.0,2024-04-20T23:52:07-0800
04/22/2024,10165.0,0.0,2024-04-22T22:46:15-0800
04/23/2024,13357.0,0.0,2024-04-23T22:51:54-0800
04/24/2024,11331.0,0.0,2024-04-24T21:03:43-0800
04/25/2024,12106.0,0.0,2024-04-25T22:37:15-0800
04/26/2024,10778.0,0.0,2024-04-26T23:00:00-0800
04/27/2024,8020.0,0.0,2024-04-27T22:12:06-0800
04/28/2024,11436.0,0.0,2024-04-28T22:17:15-0800
04/29/2024,6403.0,0.0,2024-04-29T22:28:27-0800
04/30/2024,11736.0,0.0,2024-04-30T22:56:17-0800
05/01/2024,11650.0,0.0,2024-05-01T23:00:00-0800
05/02/2024,13734.0,0.0,2024-05-02T23:00:00-0800
05/03/2024,11995.0,0.0,2024-05-03T22:20:00-0800
05/04/2024,10574.0,0.0,2024-05-04T23:00:00-0800
05/05/2024,10330.0,0.0,2024-05-05T22:40:00-0800
05/06/2024,9904.0,0.0,2024-05-06T23:00:00-0800
05/07/2024,7620.0,0.0,2024-05-07T23:00:00-0800
05/08/2024,9201.0,0.0,2024-05-08T22:00:00-0800
05/09/2024,11939.0,0.0,2024-05-09T22:40:00-0800
05/10/2024,8645.0,0.0,2024-05-10T22:30:00-0800
05/11/2024,15142.0,0.0,2024-05-11T22:10:00-0800
05/12/2024,20636.0,0.0,2024-05-12T22:00:00-0800
05/13/2024,8068.0,0.0,2024-05-13T22:53:24-0800
05/14/2024,14150.0,0.0,2024-05-14T22:18:36-0800
05/15/2024,9194.0,0.0,2024-05-15T22:33:26-0800
05/16/2024,12153.0,0.0,2024-05-16T22:35:16-0800
05/17/2024,10832.0,0.0,2024-05-17T22:49:17-0800
05/18/2024,9808.0,0.0,2024-05-18T22:59:22-0800
05/19/2024,13748.0,0.0,2024-05-19T13:52:09-0800
05/20/2024,15733.0,0.0,2024-05-20T14:55:11-0800
05/21/2024,10342.0,0.0,2024-05-21T14:31:01-0800
05/22/2024,14414.0,0.0,2024-05-22T15:02:15-0800
05/23/2024,12990.0,0.0,2024-05-23T13:47:20-0800
05/24/2024,20243.0,0.0,2024-05-24T14:35:17-0800
05/25/2024,29269.0,0.0,2024-05-25T23:00:00-0800
05/26/2024,17211.0,0.0,2024-05-26T12:54:15-0800
05/27/2024,16880.0,0.0,2024-05-27T13:44:12-0800
05/28/2024,15732.0,0.0,2024-05-28T14:17:09-0800
05/29/2024,23623.0,0.0,2024-05-29T13:29:06-0800
05/30/2024,18753.0,0.0,2024-05-30T22:59:13-0800
05/31/2024,33125.0,0.0,2024-05-31T22:55:12-0800
06/01/2024,12245.0,0.0,2024-06-01T19:54:09-0800
06/02/2024,12875.0,0.0,2024-06-02T22:28:08-0800
06/03/2024,15059.0,0.0,2024-06-03T22:45:25-0800
06/04/2024,8339.0,0.0,2024-06-04T22:46:20-0800
06/05/2024,16395.0,0.0,2024-06-05T21:39:40-0800
06/06/2024,12769.0,0.0,2024-06-06T23:00:00-0800
06/07/2024,13371.0,0.0,2024-06-07T21:46:22-0800
06/08/2024,9715.0,0.0,2024-06-08T22:58:25-0800
06/09/2024,9461.0,0.0,2024-06-09T22:59:18-0800
06/10/2024,13293.0,0.0,2024-06-10T22:59:26-0800
06/11/2024,12218.0,0.0,2024-06-11T22:44:09-0800
06/12/2024,18713.0,0.0,2024-06-12T21:16:16-0800
06/13/2024,14592.0,0.0,2024-06-13T22:59:07-0800
06/14/2024,7476.0,0.0,2024-06-14T22:49:58-0800
06/15/2024,13186.0,0.0,2024-06-15T21:11:22-0800
06/16/2024,16008.0,0.0,2024-06-16T22:15:43-0800
06/17/2024,15091.0,0.0,2024-06-17T22:56:07-0800
06/18/2024,16624.0,0.0,2024-06-18T22:37:07-0800
06/19/2024,16596.0,0.0,2024-06-19T22:56:12-0800
06/20/2024,13525.0,0.0,2024-06-20T21:46:33-0800
06/21/2024,10942.0,0.0,2024-06-21T22:33:14-0800
06/22/2024,17006.0,0.0,2024-06-22T22:32:57-0800
06/23/2024,17614.0,0.0,2024-06-23T22:53:24-0800
06/24/2024,10977.0,0.0,2024-06-24T22:53:41-0800
06/25/2024,13618.0,0.0,2024-06-25T22:02:13-0800
06/26/2024,8059.0,0.0,2024-06-26T22:15:33-0800
06/27/2024,6424.0,0.0,2024-06-27T22:41:41-0800
06/28/2024,14548.0,0.0,2024-06-28T22:34:32-0800
06/29/2024,12368.0,0.0,2024-06-29T22:11:23-0800
06/30/2024,14413.0,0.0,2024-06-30T22:53:16-0800
07/01/2024,9239.0,0.0,2024-07-01T22:14:35-0800
07/02/2024,9643.0,0.0,2024-07-02T22:59:34-0800
07/03/2024,10261.0,0.0,2024-07-03T22:18:24-0800
07/04/2024,15285.0,0.0,2024-07-04T21:24:35-0800
07/05/2024,13670.0,0.0,2024-07-05T22:49:15-0800
07/06/2024,9220.0,0.0,2024-07-06T21:34:06-0800
07/07/2024,13116.0,0.0,2024-07-07T21:44:10-0800
07/08/2024,7675.0,0.0,2024-07-08T22:51:29-0800
07/09/2024,9430.0,0.0,2024-07-09T22:11:20-0800
07/10/2024,9389.0,0.0,2024-07-10T21:51:19-0800
07/11/2024,12829.0,0.0,2024-07-11T22:42:25-0800
07/12/2024,9908.0,0.0,2024-07-12T22:48:56-0800
07/13/2024,12956.0,0.0,2024-07-13T22:58:02-0800
07/14/2024,12671.0,0.0,2024-07-14T22:48:12-0800
07/15/2024,7724.0,0.0,2024-07-15T22:43:12-0800
07/16/2024,9779.0,0.0,2024-07-16T22:38:25-0800
07/17/2024,10615.0,0.0,2024-07-17T22:28:32-0800
07/18/2024,15394.0,0.0,2024-07-18T22:52:48-0800
07/19/2024,11295.0,0.0,2024-07-19T22:14:12-0800
07/20/2024,13521.0,0.0,2024-07-20T21:59:13-0800
07/21/2024,13489.0,0.0,2024-07-21T22:26:16-0800
07/22/2024,8259.0,0.0,2024-07-22T22:16:32-0800
07/23/2024,7092.0,0.0,2024-07-23T20:50:18-0800
07/24/2024,10515.0,0.0,2024-07-24T22:58:34-0800
07/25/2024,14288.0,0.0,2024-07-25T22:12:21-0800
07/26/2024,8901.0,0.0,2024-07-26T21:32:46-0800
07/27/2024,14737.0,0.0,2024-07-27T22:42:22-0800
07/28/2024,15458.0,0.0,2024-07-28T22:51:31-0800
07/29/2024,12619.0,0.0,2024-07-29T22:50:36-0800
07/30/2024,16055.0,0.0,2024-07-30T22:43:48-0800
07/31/2024,6924.0,0.0,2024-07-31T22:31:11-0800
08/01/2024,16818.0,0.0,2024-08-01T22:56:07-0800
08/02/2024,9840.0,0.0,2024-08-02T22:55:52-0800
08/03/2024,16274.0,0.0,2024-08-03T22:41:20-0800
08/04/2024,13524.0,0.0,2024-08-04T22:58:17-0800
08/05/2024,13478.0,0.0,2024-08-05T22:31:12-0800
08/06/2024,13233.0,0.0,2024-08-06T22:06:10-0800
08/07/2024,12447.0,0.0,2024-08-07T22:55:10-0800
08/08/2024,15040.0,0.0,2024-08-08T22:43:13-0800
08/09/2024,11306.0,0.0,2024-08-09T22:49:16-0800
08/10/2024,12150.0,0.0,2024-08-10T21:57:26-0800
08/11/2024,11170.0,0.0,2024-08-11T22:58:36-0800
08/12/2024,16394.0,0.0,2024-08-12T22:59:57-0800
08/13/2024,15260.0,0.0,2024-08-13T22:46:13-0800
08/14/2024,11531.0,0.0,2024-08-14T22:54:40-0800
08/15/2024,16831.0,0.0,2024-08-15T22:35:15-0800
08/16/2024,10353.0,0.0,2024-08-16T22:36:23-0800
08/17/2024,12745.0,0.0,2024-08-17T22:55:06-0800
08/18/2024,17065.0,0.0,2024-08-18T22:47:18-0800
08/19/2024,14721.0,0.0,2024-08-19T22:51:18-0800
08/20/2024,12581.0,0.0,2024-08-20T22:42:48-0800
08/21/2024,6655.0,0.0,2024-08-21T22:49:15-0800
08/22/2024,13238.0,0.0,2024-08-22T22:54:22-0800
08/23/2024,8506.0,0.0,2024-08-23T22:58:28-0800
08/24/2024,10444.0,0.0,2024-08-24T22:58:29-0800
08/25/2024,15026.0,0.0,2024-08-25T22:51:22-0800
08/26/2024,13729.0,0.0,2024-08-26T22:35:22-0800
08/27/2024,7219.0,0.0,2024-08-27T21:21:09-0800
08/28/2024,5839.0,0.0,2024-08-28T19:49:06-0800
08/29/2024,2912.0,0.0,2024-08-29T19:10:12-0800
08/30/2024,6216.0,0.0,2024-08-30T22:48:14-0800
08/31/2024,7818.0,0.0,2024-08-31T21:35:33-0800
09/01/2024,10343.0,0.0,2024-09-01T22:22:10-0800
09/02/2024,7852.0,0.0,2024-09-02T22:49:20-0800
09/03/2024,10733.0,0.0,2024-09-03T22:42:26-0800
09/04/2024,8989.0,0.0,2024-09-04T22:17:09-0800
09/05/2024,8636.0,0.0,2024-09-05T22:10:10-0800
09/06/2024,12029.0,0.0,2024-09-06T22:33:07-0800
09/07/2024,13097.0,0.0,2024-09-07T21:47:18-0800
09/08/2024,15435.0,0.0,2024-09-08T20:53:10-0800
09/09/2024,10911.0,0.0,2024-09-09T22:50:10-0800
09/10/2024,8943.0,0.0,2024-09-10T21:41:32-0800
09/11/2024,10395.0,0.0,2024-09-11T22:28:16-0800
09/12/2024,12901.0,0.0,2024-09-12T22:57:08-0800
09/13/2024,7794.0,0.0,2024-09-13T22:10:13-0800
09/14/2024,12112.0,0.0,2024-09-14T22:49:19-0800
09/15/2024,13910.0,0.0,2024-09-15T21:57:24-0800
09/16/2024,13376.0,0.0,2024-09-16T21:44:59-0800
09/17/2024,10903.0,0.0,2024-09-17T20:32:34-0800
09/18/2024,13091.0,0.0,2024-09-18T21:58:17-0800
09/19/2024,15302.0,0.0,2024-09-19T22:36:13-0800
09/20/2024,15938.0,0.0,2024-09-20T21:48:02-0800
09/21/2024,15257.0,0.0,2024-09-21T21:19:37-0800
09/22/2024,7007.0,0.0,2024-09-22T21:21:28-0800
09/23/2024,14164.0,0.0,2024-09-23T21:51:37-0800
09/24/2024,7938.0,0.0,2024-09-24T21:16:13-0800
09/25/2024,9245.0,0.0,2024-09-25T22:04:18-0800
09/26/2024,8611.0,0.0,2024-09-26T12:49:34-0800
09/27/2024,7811.0,0.0,2024-09-27T21:02:49-0800
09/28/2024,15648.0,0.0,2024-09-28T22:17:21-0800
09/29/2024,11069.0,0.0,2024-09-29T22:10:15-0800
09/30/2024,16220.0,0.0,2024-09-30T22:12:43-0800
10/01/2024,16127.0,0.0,2024-10-01T22:04:32-0800
10/02/2024,10427.0,0.0,2024-10-02T20:42:14-0800
10/03/2024,18759.0,0.0,2024-10-03T21:42:19-0800
10/04/2024,10184.0,0.0,2024-10-04T22:02:45-0800
10/05/2024,15100.0,0.0,2024-10-05T22:23:01-0800
10/06/2024,20176.0,0.0,2024-10-06T22:30:54-0800
10/07/2024,14090.0,0.0,2024-10-07T21:41:15-0800
10/08/2024,17021.0,0.0,2024-10-08T22:11:23-0800
10/09/2024,4690.0,0.0,2024-10-09T22:18:07-0800
11/18/2025,7882.0,0.0,2025-11-18T23:15:40-0800
11/19/2025,9974.0,0.0,2025-11-19T23:25:14-0800
11/20/2025,13582.0,0.0,2025-11-20T23:02:39-0800
11/21/2025,14763.0,0.0,2025-11-21T23:39:22-0800
11/22/2025,15363.0,0.0,2025-11-22T23:04:06-0800
11/23/2025,12590.0,0.0,2025-11-23T10:49:30-0800
11/24/2025,8310.0,0.0,2025-11-24T08:54:03-0800
11/25/2025,8561.0,0.0,2025-11-25T07:57:15-0800
11/26/2025,17490.0,0.0,2025-11-26T11:51:01-0800
11/27/2025,15853.0,0.0,2025-11-27T00:40:40-0800
11/29/2025,18101.0,0.0,2025-11-29T23:13:18-0800
11/30/2025,16488.0,0.0,2025-11-30T23:03:23-0800
12/01/2025,8395.0,0.0,2025-12-01T23:11:11-0800
12/02/2025,7871.0,0.0,2025-12-02T23:49:08-0800
12/03/2025,12466.0,0.0,2025-12-03T23:00:18-0800
12/04/2025,9643.0,0.0,2025-12-04T23:22:16-0800
12/05/2025,11882.0,0.0,2025-12-05T23:32:23-0800
12/06/2025,16410.0,0.0,2025-12-06T18:49:15-0800
12/07/2025,14255.0,0.0,2025-12-07T08:04:13-0800
12/08/2025,7418.0,0.0,2025-12-08T07:16:21-0800
12/09/2025,8175.0,0.0,2025-12-09T07:37:16-0800
12/10/2025,8025.0,0.0,2025-12-10T07:41:19-0800
12/11/2025,10927.0,0.0,2025-12-11T08:21:10-0800
12/12/2025,12837.0,0.0,2025-12-12T06:42:22-0800
12/13/2025,17377.0,0.0,2025-12-13T07:26:30-0800
12/14/2025,15010.0,0.0,2025-12-14T08:14:31-0800
12/15/2025,8177.0,0.0,2025-12-15T07:09:08-0800
12/16/2025,10373.0,0.0,2025-12-16T08:49:22-0800
12/17/2025,12175.0,0.0,2025-12-17T21:33:37-0800
12/18/2025,7977.0,0.0,2025-12-18T21:24:26-0800
12/19/2025,5534.0,0.0,2025-12-19T18:29:34-0800
12/20/2025,5469.0,0.0,2025-12-20T19:31:07-0800
12/21/2025,3763.0,0.0,2025-12-21T20:42:30-0800
12/22/2025,3744.0,0.0,2025-12-22T20:22:14-0800
12/23/2025,4354.0,0.0,2025-12-23T07:04:16-0800
12/24/2025,4031.0,0.0,2025-12-24T20:14:51-0800
12/25/2025,10752.0,0.0,2025-12-25T20:57:14-0800
12/26/2025,10477.0,0.0,2025-12-26T09:58:15-0800
12/27/2025,7466.0,0.0,2025-12-27T20:53:16-0800
12/28/2025,6993.0,0.0,2025-12-28T18:14:31-0800
12/29/2025,11502.0,0.0,2025-12-29T21:08:12-0800
12/30/2025,12060.0,0.0,2025-12-30T20:58:29-0800
12/31/2025,7250.0,0.0,2025-12-31T22:26:18-0800
01/01/2026,7171.0,0.0,2026-01-01T21:32:17-0800
01/02/2026,12335.0,0.0,2026-01-02T22:14:34-0800
01/03/2026,11225.0,0.0,2026-01-03T21:59:13-0800
01/04/2026,11652.0,0.0,2026-01-04T16:48:04-0800
01/05/2026,8094.0,0.0,2026-01-05T12:07:17-0800
01/06/2026,8218.0,0.0,2026-01-06T23:18:17-0800
01/07/2026,4612.0,0.0,2026-01-07T09:04:48-0800
